"","id","created_time","snippet","headline","news_desk","company_name"
"918",8,"2011-04-05T11:56:52+0000","What a 47-year-old book tells us about the political climate of today.","Anti-Intellectualism in America, Then and Now","","American Express"
"919",9,"2011-12-03T00:50:16+0000","An effort to appeal to Israeli patriotism struck a sour note with American Jews.","After American Jewish Outcry, Israel Ends Ad Campaign Aimed at Expatriates","Foreign","American Express"
"920",10,"2011-02-08T17:00:40+0000","More than 8 in 10 Americans say they are sympathetic to the protesters in Egypt who have called for a change in their government, according to a new Gallup poll.","Broad Majority of Americans Sympathetic to Egyptian Protesters","","American Express"
"921",1,"2011-02-08T17:00:40+0000","More than 8 in 10 Americans say they are sympathetic to the protesters in Egypt who have called for a change in their government, according to a new Gallup poll.","Broad Majority of Americans Sympathetic to Egyptian Protesters","","American Express"
"922",2,"2011-05-16T19:23:12+0000","Credit card issuers are intensely interested in business travelers. The right card can offer perks suited to the way you travel.","The Right Plastic for Perks","Business","American Express"
"923",3,"2011-04-12T22:15:38+0000","Little players issue smart cards but big American banks don’t.","Small Players Offer Smart Cards, but Not Big Banks","","American Express"
"924",4,"2011-10-31T15:41:21+0000","President Hamid Karzai moved quickly to make amends for not mentioning, at first, NATO personnel killed by a suicide bomber.","Afghan Leader Offers Belated Condolences for U.S. Deaths","Foreign","American Express"
"925",5,"2011-03-02T16:14:13+0000","At the Geneva auto show, brand executives said that the striking coupe, scheduled for production in 2012, could herald the Italian marque’s long-delayed return to the North American market.","Alfa Romeo 4C Concept: America Bound?","","American Express"
"926",6,"2011-07-27T17:51:13+0000","Ludwig Willisch will replace Jim O’Donnell, inheriting a region with sales momentum that could lead the brand past Lexus by year’s end.","BMW Group Appoints New President for North American Region","","American Express"
"927",7,"2011-09-03T00:19:52+0000","States’ efforts to outlaw Islamic law resemble 19th-century anti-Semitism.","Don’t Fear Islamic Law in America","OpEd","American Express"
"928",8,"2011-10-16T01:44:08+0000","Hundreds and in some cases thousands of people expressed discontent with the economy in Asia, the Americas and Europe.","Rallies Across the Globe Protest Economic Policies","World","American Express"
"929",9,"2011-08-19T09:40:36+0000","Enter Elizabeth Warren.","Finally, Someone to Run Against Wall Street","OpEd","American Express"
"930",10,"2011-12-05T22:50:37+0000","An antitrust hearing will examine assertions by opponents that competition and costs will suffer if a deal between Express Scripts and Medco Health Solutions proceeds.","Concerns Over Merger in Pharmacy","Business","American Express"
"931",1,"2011-09-13T20:54:41+0000","The German automaker’s redesigned B-Class is more stylish and sporty than its predecessor, which was never sold in the United States.","Mercedes-Benz B-Class Is Coming to America","","American Express"
"932",2,"2011-10-22T04:35:36+0000","According to an American who has lived in Iran since he assassinated a former member of the Shah’s government in the Washington suburbs in 1980, an alleged Iranian plot to kill the Saudi ambassador in Washington “just makes no sense at all.”","American Who Killed for Iran in 1980 Resurfaces to Comment on Alleged Plot","","American Express"
"933",3,"2011-11-23T18:05:50+0000","Officials from the race series must confront a number of issues relating to the sport’s proposed return to the country.","On Eve of 2011 Finale, Formula One Faces Problems From a Strange Land Called America","","American Express"
"934",4,"2011-06-08T14:49:19+0000","For years, American travelers have had trouble using their credit cards in other countries. Now some card issuers are trying to do something about it.","How to Avoid Credit Card Problems Abroad","Travel","American Express"
"935",5,"2011-12-12T02:46:04+0000","The Afghan ambassador promised to look into circumstances that Iran has said ended with its recovery of a C.I.A. spy plane.","Iran Complains to Afghanistan About U.S. Drone","Foreign","American Express"
"936",6,"2011-06-08T12:18:10+0000","The Middle East now taking shape may prove to be less accommodating to American interests.","A Post-American Day Dawns in the Mideast","Editorial","American Express"
"937",7,"2011-10-17T00:46:02+0000","Iran, responding to American efforts to isolate it in the wake of an alleged assassination plot, offered tough words from two top leaders on Sunday.","Iran Reacts to Pressure From America","Foreign","American Express"
"938",8,"2011-12-15T04:30:42+0000","Following a look at how the war has impacted those living in Baghdad, we now turn to the Anbar Province.","What Iraqis Think of the American Withdrawal: Anbar Province","","American Express"
"939",9,"2011-09-01T04:05:00+0000","This word has appeared in 52 New York Times articles in the past year.","Word of the Day | smirk","","American Express"
"940",10,"2011-05-09T18:34:51+0000","Nearly four in 10 voter (37 percent) said they had a unfavorable opinion of the former House speaker.","Recent Poll Shows Gingrich Has Work to Do","","American Express"
"941",1,"2011-02-04T23:22:00+0000","Sergio Marchionne, the Italian auto executive who took over Chrysler as part of its government-backed bankruptcy, deplored the high interest rate the company’s paying.","Chrysler Chief Marchionne Unhappy With Terms of U.S. Loans","","American Express"
"942",2,"2011-03-23T12:23:36+0000","The bank revealed on Wednesday that the Federal Reserve had blocked its plan to increase its dividend in the second half of 2011.","Fed Rejects Bank of America’s Dividend Plan","","American Express"
"943",3,"2011-07-14T16:46:19+0000","A soldier returning from Afghanistan sees America with a newly grateful set of eyes.","A Burger and a Happy Homecoming","","American Express"
"944",4,"2011-01-27T17:25:15+0000","Holders of American Express’ Centurion card, commonly known as the black card, can now negotiate car prices online and earn perks from manufacturers like Tesla Motors and Jaguar.","For Luxury Car Customers, an AmEx Card That Drives a Hard Bargain","","American Express"
"945",5,"2011-02-01T10:25:02+0000","Student Opinion | Is your background a source of pride, confusion, discomfort or something else?","What Is Your Racial and Ethnic Identity?","","American Express"
"946",6,"2011-06-03T01:31:03+0000","The efforts, from the Republican leadership and a liberal Democrat, highlight tensions over a president’s ability to wage war.","House Sets Votes on Two Resolutions Critical of U.S. Role in Libyan Conflict","Foreign","American Express"
"947",7,"2011-11-04T01:36:14+0000","Despite the legacy of the torture scandal at the Abu Ghraib prison, some there are ambivalent about the imminent departure of American troops.","At Abu Ghraib, Ambivalence on America’s Departure","Foreign","American Express"
"948",8,"2011-12-10T02:46:44+0000","The maker of telephone equipment said it would not seek new customers in Iran and would limit business activities with existing customers because of the situation there.","Chinese Manufacturer Restricts Business With Iran","Business","American Express"
"949",9,"2011-02-10T12:18:10+0000","In Egypt and around the world, we are witnessing an historic eclipse of U.S. influence.","America's Unraveling Power","Editorial","American Express"
"950",10,"2011-03-16T09:07:15+0000","The United States told its citizens to stay at least 50 miles away, while Japan has evacuated only within 12 miles.","U.S. Urges Wider No-Go Area Around Nuclear Plant","Foreign","American Express"
"951",1,"2011-09-13T20:20:51+0000","Four American military personnel are in the Libyan capital to determine what security measures are necessary to reopen the United States Embassy, a Pentagon spokesman said on Tuesday.","American Military Team Visits Libya to Assess Risks of Reopening U.S. Embassy","Foreign","American Express"
"952",2,"2011-08-18T00:15:47+0000","An antitrust hurdle in Medco Health’s effort to buy Express Script may not be as high as investors fear.","Qualms on Medco May Be Premature","Business","American Express"
"953",3,"2011-11-19T21:11:29+0000","Mohammad Javad Larijani never finished graduate studies at Berkeley. Instead, he became a quotable, English-speaking, official defender of Iran’s Islamic Revolution.","A Diplomatic Face Seeks to Counter Iran’s Critics","Foreign","American Express"
"954",4,"2011-01-10T02:55:44+0000","A study by the San Francisco Fed says quantitative easing will help create 700,000 jobs and put a floor under prices. Not all are convinced.","Economists Express Caution on Forecasts in a Fed Study","Business","American Express"
"955",5,"2011-12-14T16:56:09+0000","Recent surveys show that while Newt Gingrich is popular among Republican primary voters, he would face a more critical audience among the general electorate.","Independents a Problem for Gingrich, Polls Find","","American Express"
"956",6,"2011-01-10T18:30:23+0000","The front man of the band Green Day discussed the idea of making an “American Idiot” movie and the concept of creating an original musical.","Billie Joe Armstrong Considers Film and Theater Projects","","American Express"
"957",7,"2011-09-15T06:05:50+0000","Turkey will locate an early-warning radar system, part of a new NATO shield against a missile attack in Europe, a Foreign Ministry spokesman said.","Turkey: New Site for Missile Shield Plan","Foreign","American Express"
"958",8,"2011-08-26T01:12:16+0000","An investor seen as having the golden touch rejuvenates Bank of America’s stock with his $5 billion vote of confidence.","Buffett’s Bank of America Stake Is Viewed as a Seal of Approval","","American Express"
"959",9,"2011-01-17T11:00:37+0000","The needs of American workers and consumers and those of corporate investors no longer align, and the gap is intensified by globalization, an economist writes.","Borderless Economy, Jobless Prosperity","","American Express"
"960",10,"2011-07-18T01:21:56+0000","Economic reports, corporate earnings and hearings this week in Europe.","Looking Ahead to Economic Reports This Week","Business","American Express"
"961",1,"2011-12-14T01:14:27+0000","At least two advertisers have withdrawn commercials from TLC’s “All-American Muslim” since an organization called the Florida Family Association condemned the show, but other advertisers cited by the organization as pulling out as sponsors are dis...","Controversy Drives Advertisers From  ‘All-American Muslim’ — Or Does it?","","American Express"
"962",2,"2011-01-17T11:00:37+0000","The needs of American workers and consumers and those of corporate investors no longer align, and the gap is intensified by globalization, an economist writes.","Borderless Economy, Jobless Prosperity","","American Express"
"963",3,"2011-05-19T00:26:13+0000","The secretary of state is engaging in a quiet campaign to repair relations with a region that complains it has been ignored by American policy makers.","Clinton Aims to Improve Ties With Latin America","Foreign","American Express"
"964",4,"2011-10-17T00:26:12+0000","The November issue of the American Marie Claire was selected to introduce the supplement because the issue is devoted to the subject of money.","Magazine Creates a Brand for Women Who Work","Business","American Express"
"965",5,"2011-05-02T21:43:01+0000","For the first time on record, most Americans say they do not believe today’s youth will have better lives than their parents, according to new survey data from Gallup.","Dimming Optimism for Today’s Youth","","American Express"
"966",6,"2011-01-18T12:18:12+0000","Both countries have huge incentives to get along, and the world faces many dangers if they fail to do so.","What America and China Must Not Forget","Editorial","American Express"
"967",7,"2011-02-17T10:19:01+0000","A court gave the Pakistani government three weeks to decide whether the American official in custody for killing two Pakistanis has diplomatic immunity.","Pakistan Delays Ruling on Jailed American","Foreign","American Express"
"968",8,"2011-07-29T16:09:07+0000","The White House asked allies to express support for #compromise on Twitter.","The President Calls In His Hashtag Team","","American Express"
"969",9,"2011-07-10T22:54:31+0000","A concert performance in Dallas by the singer Rihanna ended abruptly on Friday night after a small fire broke out above the stage.","Fire Stops Rihanna","Culture","American Express"
"970",10,"2011-05-14T00:51:38+0000","Consumers have been constrained by the housing crisis, a weak job market and high energy prices, but economists now are cautiously forecasting a turnaround in spending.","Recovery Seen in Rising Use of Credit Cards","Business","American Express"
"971",1,"2011-10-18T08:04:25+0000","On Oct. 18, 1968, the United States Olympic Committee suspended the medal-winning sprinters Tommie Smith and John Carlos and barred them from the Olympic Village for their conduct during the playing of “The Star-Spangled Banner” in Mexico City.","Oct. 18, 1968 | American Olympic Medal Winners Suspended for Black Power Salutes","","American Express"
"972",2,"2011-10-13T04:06:52+0000","A Virginia resident, Mohamad Anas Haitham Soueid, is accused of collecting information about people protesting in the United States against the Assad government.","Syrian-American Is Arrested on Charges of Spying for Damascus","Foreign","American Express"
"973",3,"2011-09-25T04:02:22+0000","The couple both work in Berlin.","Joanna Ganson, Daniel Pritchett","Society","American Express"
"974",4,"2011-11-01T01:33:34+0000","The strange, meteoric rise of Gen. George McClellan.","‘The Napoleon of the American Republic’","","American Express"
"975",5,"2011-06-29T14:49:59+0000","The annual benefit dinner for the Bedford Stuyvesant Restoration Corporation, a nonprofit organization with roots dating back to Robert F. Kennedy, gave its annual Founders Award to Lloyd C. Blankfein, Goldman Sachs’ chief executive, who grew up i...","Can’t Take Brooklyn Out of Blankfein","","American Express"
"976",6,"2011-07-07T01:15:16+0000","A book deal for Julian Assange, the founder of WikiLeaks, has reportedly fallen through over concerns the information could be used against him by United States prosecutors.","WikiLeaks Memoir ‘Postponed’","Foreign","American Express"
"977",7,"2011-07-06T22:41:02+0000","A book deal that Julian Assange, the founder of WikiLeaks, signed only six months ago has fallen through, according the Guardian.","Memoir of WikiLeaks Founder Is Tabled","","American Express"
"978",8,"2011-06-21T13:10:28+0000","A spokesman for Pakistan’s military confirmed on Tuesday that a senior officer had been detained and was under investigation for suspected ties to militants.","Pakistan Detains Senior Army Officer Over Suspected Militant Ties","","American Express"
"979",9,"2011-09-28T13:11:51+0000","Peter R. Orszag, President Obama’s former budget director, argues for taking power away froma gridlocked government and giving it to “independent institutions.”","Stealth Democracy","","American Express"
"980",10,"2011-09-30T10:48:11+0000","Highlights from the IHT archives.","100, 75, 50 Years Ago","Editorial","American Express"
"981",1,"2011-05-20T18:05:16+0000","Making more sense than reality.","I Really Should Read The Onion More Regularly","","American Express"
"982",2,"2011-11-22T23:48:57+0000","Here’s my preferred selection of works by Roth. But first, let’s talk about Saul Bellow.","My Three Favorite Philip Roth Books, or Rereading ‘Herzog’","","American Express"
"983",3,"2011-08-05T10:59:15+0000","Industrial and Commercial Bank of China agreed to pay the South African lender Standard Bank $600 million for control of three financial units in Argentina.","I.C.B.C. to Buy Controlling Stake in Argentine Bank","","American Express"
"984",4,"2011-02-15T23:29:38+0000","Senator John Kerry says diplomatic immunity applies in the case of an American official accused of killing two Pakistanis he says tried to rob him.","Kerry Says U.S. Will Investigate Case of American Accused of Killing 2 Pakistanis","Foreign","American Express"
"985",5,"2011-05-19T00:42:29+0000","Demands in mid-February for a change in the way Iraq’s Kurdish region is governed were met with gunfire and arrests.","Anger Lingers in Iraqi Kurdistan After a Crackdown","Foreign","American Express"
"986",6,"2011-07-07T23:37:33+0000","Robert S. Ford, the American ambassador to Syria, made an unannounced visit on Thursday to Hama, a central Syrian city that has become a focal point for the four-month uprising.","American Ambassador to Syria Visits Focal Point in Uprising","Foreign","American Express"
"987",7,"2011-08-18T04:28:51+0000","Vice President Joseph R. Biden Jr. arrived in China and began talks with Vice President Xi Jinping of China that will focus on the global economy, trade and currency.","Cooperation Emphasized as Biden Visits China","Foreign","American Express"
"988",8,"2011-05-09T01:15:46+0000","Concerns about the security of Japanese nuclear plants from terrorist attacks were rebuffed by local officials at least once, according to classified State Department cables made available by Wikileaks.","Japan’s Nuclear Sites Raised U.S. Concerns, Cables Show","Foreign","American Express"
"989",9,"2011-06-30T22:13:41+0000","Polina Semionova, a star of American Ballet Theater’s “Swan Lake,” possesses an arresting naturalness.","Emotions Expressed With a Glance","Weekend","American Express"
"990",10,"2011-09-30T10:48:11+0000","Highlights from the IHT archives.","100, 75, 50 Years Ago","Editorial","American Express"
"991",1,"2011-06-30T22:13:41+0000","Polina Semionova, a star of American Ballet Theater’s “Swan Lake,” possesses an arresting naturalness.","Emotions Expressed With a Glance","Weekend","American Express"
"992",2,"2011-04-18T23:51:24+0000","Alfred F. Kelly Jr., a former president of American Express, was chosen by the owners of the Jets and the Giants to run the host committee for the 2014 Super Bowl at New Meadowlands Stadium.","City’s Super Bowl Chooses Lead Host","Sports","American Express"
"993",3,"2011-10-31T01:07:47+0000","An Islamist militia in Somalia said that Abdisalan Hussein Ali, who spent his formative years in Minneapolis, was one of two bombers in a suicide attack in Mogadishu.","American Identified as Bomber in Attack on African Union in Somalia","Foreign","American Express"
"994",4,"2011-08-18T04:28:51+0000","Vice President Joseph R. Biden Jr. arrived in China and began talks with Vice President Xi Jinping of China that will focus on the global economy, trade and currency.","Cooperation Emphasized as Biden Visits China","Foreign","American Express"
"995",5,"2011-04-01T18:45:46+0000","At current interest rates, a 5-year-old can double his money — just in time to start collecting Medicare.","Slow Compounding","Business","American Express"
"996",6,"2011-12-10T13:00:40+0000","Recent polls show that Americans are worrying more about their gift spending, even as they plan to spend less.","Holiday Spending Stress","","American Express"
"997",7,"2011-05-24T11:31:00+0000","President Obama will visit Missouri upon his return from Europe.","Obama Consoles Tornado Victims From Afar","","American Express"
"998",8,"2011-12-28T18:18:52+0000","A key to the photo collage.","Apropos Appropriation","Arts","American Express"
"999",9,"2011-08-26T00:07:52+0000","The two spills occurred in June in the country’s largest offshore oilfield and spread in Bohai Bay.","China to Sue ConocoPhillips Over Oil Spills","Foreign","American Express"
"1000",10,"2011-03-31T01:22:00+0000","A top propagandist for Al Qaeda said in a video posted on the Web that Islamists had been elated by the protests around the Arab world.","Islamists Are Elated by Revolts, Cleric Says","Foreign","American Express"
"1001",1,"2011-11-10T13:39:06+0000","Ms. Blige said she plans to perform songs from her new album, “My Life II… The Journey Continues (Act 1),” as well the entirety of its 1994 predecessor, “My Life,” at a Nov. 17 concert that will be directed by Adam Shankman and shown live on the I...","Mary J. Blige to Celebrate ‘Life,’ Past and Present, With Online Concert Broadcast","","American Express"
"1002",2,"2011-10-19T19:19:00+0000","American Express is the latest big financial services company to equalize the cost of health insurance for its employees with same-sex partners.","Amex Equalizes Health Costs for Gay Employees","","American Express"
"1003",3,"2011-09-21T12:08:22+0000","The financing round, led by JPMorgan Chase, American Express and Citigroup, values e-commerce platform company at $1.35 billion.","Rearden Commerce Raises $133 Million","","American Express"
"1004",4,"2011-09-14T15:41:24+0000","Virgin America is replacing Continental in American Express’s Membership Rewards program","Virgin America Subs for Continental in Membership Rewards Program","","American Express"
"1005",5,"2011-09-10T20:00:01+0000","Wickmayer, Cahill, and Venus Williams also had unexpected success at the U.S. Open.","Surprise Semifinalists, from Evert to Kerber","","American Express"
"1006",6,"2011-08-26T16:58:44+0000","As Hurricane Irene travels up the East Coast, New York is steeling itself for disaster, with several big financial firms located in designated flood zones.","As Irene Approaches, Banks Prepare for the Worst","","American Express"
"1007",7,"2011-08-25T16:15:03+0000","While he is investing $5 billion into Bank of America, Warren E. Buffett is no stranger to taking up positions in the nation’s biggest lenders.","Buffett Adds Another Bank to His Portfolio","","American Express"
"1008",8,"2011-08-02T16:33:24+0000","The metropolitan area will get $1 million under the Partners in Preservation program.","Twin Cities Getting Preservation Grants from American Express","","American Express"
"1009",9,"2011-06-14T14:50:27+0000","American Express introduced a reloadable prepaid card that isn’t packed with hidden fees.","New American Express Prepaid Card Is Light on Fees","","American Express"
"1010",10,"2011-06-01T15:59:51+0000","The Costco American Express card will soon refund 2 percent of restaurant purchases instead of the current 3 percent.","American Express Costco Card to Lower Restaurant Rebate","","American Express"
"1011",1,"2011-05-04T20:57:26+0000","American Express Travel is offering a new twist on trip planning that promises to inject some fun spontaneity into travel: it chooses destinations for you, and shares the details later.","Surprise! American Express Picks Your Destination for You","","American Express"
"1012",2,"2011-04-27T12:46:18+0000","American Express changes its Blue Cash credit cards, reducing some benefits for new customers while improving the rate of one existing rebate.","Big Changes to American Express’s Blue Cash Card","","American Express"
"1013",3,"2011-01-24T17:18:47+0000","American Express will help Black Card holders negotiate prices on luxury automobiles.","American Express’s New Service for Its Wealthiest Cardholders","","American Express"
"1014",4,"2011-07-05T16:53:29+0000","Chase adds another credit card to the list of those that don’t charge currency conversion fees for travel outside of the United States.","Credit Cards Without Foreign Transaction Fees","","American Express"
"1015",5,"2011-06-23T01:05:03+0000","American Express cardholders will receive discounts at certain shops and restaurants on their cellphone through an alliance with Foursquare.","A Start-Up Matures, Working With AmEx","Business","American Express"
"1016",6,"2011-05-03T17:55:40+0000","If you follow your company’s expense policy, you shouldn’t be held liable for your corporate card balance.","Troubled Employers and Your Company Charge Card","","American Express"
"1017",7,"2011-07-22T18:32:54+0000","Shares in Medco continued to climb after it agreed to merge with Express Scripts, but they remained well below the bid price, in large part because of antitrust concerns.","Medco Shares Remain Below Express Scripts Bid","","American Express"
"1018",8,"2011-07-22T02:25:06+0000","Express Scripts’ offer for Medco Health Solutions has the potential for big savings and antitrust questions.","Express Scripts’ Bid for Medco Health Carries Risks","Business","American Express"
"1019",9,"2011-11-08T15:54:02+0000","The change is seen as part of an effort to settle lawsuits against Medco that accuse the company of selling itself  too cheaply to Express Scripts.","Express Scripts Cuts Termination Fee in Medco Deal","","American Express"
"1020",10,"2011-07-21T09:13:17+0000","Express Scripts, the pharmacy benefits manager, is buying Medco Health Solutions for $29.1 billion, a major consolidation for a health care industry in transition.","Express Scripts to Buy Medco for $29 Billion","","American Express"
"1021",1,"2011-07-21T17:53:54+0000","Investors and analysts applauded Express Scripts’ proposed takeover of Medco Health Solutions, pushing shares in both companies up significantly on Thursday.","Shares of Express Scripts and Medco Jump on Deal News","","American Express"
"1022",2,"2011-01-13T19:04:25+0000","CardRatings.com’s take on the worst and best credit cards of the last year.","The Worst and Best Credit Cards of 2010","","American Express"
