"","id","created_time","snippet","headline","news_desk","company_name"
"2315",5,"2015-10-06T10:04:49+0000","Bernanke’s Frank Look at Lehman Brothers | Supreme Court Denies Insider Trading Hearing","Morning Agenda: Activist Investors and Billion-Dollar Bets","","American Express"
"2316",6,"2015-09-04T16:29:21+0000","The activist investor ValueAct Capital’s best bet for shaking up the card and payments giant might also be going after the chief executive.","American Express May Get Same Treatment as Microsoft From ValueAct Capital  ","Business","American Express"
"2317",7,"2015-08-07T18:56:21+0000","Shares of the credit card company jumped after the news that ValueAct Capital Management, a prominent activist hedge fund, had made a major investment.","Activist Hedge Fund Takes Significant Stake in American Express","Business","American Express"
"2318",8,"2015-08-05T00:58:01+0000","Citing “egregious conduct” in text messages and emails between two lawyers, a federal judge scrapped a proposed $75 million settlement between American Express and a group of retailers.","Judge Rejects Settlement in American Express Case ","Business","American Express"
"2319",9,"2015-08-06T07:21:04+0000","Credit card companies have upended the business model of sex traffickers by eliminating a way they pay for advertising.","Making Life Harder for Pimps","OpEd","American Express"
"2320",10,"2015-08-05T13:34:06+0000","Neiman Marcus files for I.P.O. | Shire Rebuffed by Baxalta | A Sydney Exchange Woos Chinese Listings","Morning Agenda: Puerto Rico’s Next Debt Problem","","American Express"
"2321",1,"2015-07-28T04:01:02+0000","The San Francisco-based digital payments start-up now has a $5 billion valuation and a partnership with Visa to help it compete.","Stripe, Digital Payments Start-Up, Raises New Funding and Partners With Visa","Business","American Express"
"2322",2,"2015-11-08T04:08:16+0000","Senator Marco Rubio’s campaign released American Express statements from 2005 and 2006 in response to questions about his use of a card belonging to the Florida Republican Party, saying that only eight of the charges were for personal expenses and...","Marco Rubio’s American Express Statements","U.S.","American Express"
"2323",3,"2015-02-19T17:13:34+0000","The company has long barred merchants from encouraging customers to pay with credit cards that charge lower fees.","American Express Violated Antitrust Laws, Judge Rules","Business","American Express"
"2324",4,"2015-03-18T04:01:18+0000","The company, called Plenti, will let customers earn points from several merchants, not just American Express.","American Express to Start Multi-Business Loyalty Program","Business","American Express"
"2325",5,"2015-05-29T19:35:59+0000","Mr. Gilligan was largely seen as the likely successor to Kenneth Chenault, the chief executive.","Edward P. Gilligan, American Express Executive, Dies at 55","Business","American Express"
"2326",6,"2015-02-26T19:04:09+0000","The company, seeking to reinvigorate its brand after some setbacks, plans to enhance the benefits of its popular gold card, but also raise the fees.","With Revamped Gold Cards, Bruised American Express Returns Focus to Affluent","Business","American Express"
"2327",7,"2015-07-03T13:05:42+0000","Auto policies and some credit cards will often cover rentals, but such coverage can come with restrictions.","Check Insurance Coverage When Renting a Car","Business","American Express"
"2328",8,"2015-06-21T21:21:40+0000","Church members express thanks and hope following Sunday services at African-American church where nine people were slaughtered last Wednesday. Diane Hodges reports.","Charleston church-goers express hope after shooting","","American Express"
"2329",9,"2015-05-12T09:29:19+0000","Valerie Soranno Keating, the chief executive, joined the bank in 2009 after a 16-year career with American Express.","Head of Barclays Credit Card Business to Step Down","Business","American Express"
"2330",10,"2015-02-24T02:36:15+0000","If history is any guide, the ruling against American Express will not lead to the desired outcome of increased competition and lower prices.","Amex’s Loss in Court May Not Help Consumers","Business","American Express"
"2331",1,"2015-09-22T17:39:11+0000","The buffet-style chain is returning to a market saturated with traditional Chinese restaurants.","Panda Express Takes a Second Run at New York","Dining","American Express"
"2332",2,"2015-02-22T15:35:10+0000","Rudolph W. Giuliani, the former mayor of New York City, has challenged the media to find examples of President Obama expressing affection for the United States. Has the president done so? A review of his public remarks provides multiple examples.","President Obama Has, in Fact, Expressed Love for His Country","","American Express"
"2333",3,"2015-08-21T07:06:24+0000","Test your knowledge of Asian-American history by playing our crossword.","Student Crossword | Asian-American History","","American Express"
"2334",4,"2015-07-14T15:14:55+0000","Statements from White House hopefuls warned of nuclear chaos in the Middle East, criticism of President Obama’s abilities as a negotiator, and calls on Congress to stop the deal with Iran in its tracks.","Republican Candidates Express Strong Opposition to Iran Deal","Politics","American Express"
"2335",5,"2015-02-25T10:45:12+0000","The writer Billy Hayes, whose memoir about his 1970 arrest and imprisonment in Turkey cast a shadow on tourism there, now praises the country’s hospitality.","From ‘Midnight Express’ to Discovering the Allure of Turkey","Travel","American Express"
"2336",6,"2015-10-06T21:00:42+0000","Rather than bargain with a single maker, the pharmacy benefits manager says it will offer both Repatha and Praluent, promising but expensive products.","Express Scripts Says It Will Cover 2 New Cholesterol Drugs","Business","American Express"
"2337",7,"2015-03-07T19:39:37+0000","There’s so much we can’t express because the symbols don’t exist: no Vulcan salute, no pickup truck, no bacon.","America Needs Its Own Emojis ","OpEd","American Express"
"2338",8,"2015-10-15T00:43:41+0000","Support for militias could be an area where American and Russian interests in Syria converge, or it could become another point of contention, as they compete for the Kurds’ affections.","Turkey Expresses Concern to U.S. and Russia Over Help for Syrian Kurds","Foreign","American Express"
"2339",9,"2015-06-02T11:00:28+0000","Americans of both parties reject the regime of untrammeled money in elections, but more than half are pessimistic that improvements will be made.","Poll Shows Americans Favor an Overhaul of Campaign Financing","National","American Express"
"2340",10,"2015-04-07T09:56:35+0000","The merger would greatly expand FedEx’s presence in Europe and comes less than two years since European regulators blocked a bid for TNT by UPS.","FedEx Agrees to Acquire TNT Express in $4.8 Billion Deal","Business","American Express"
"2341",1,"2015-04-07T09:56:35+0000","The merger would greatly expand FedEx’s presence in Europe and comes less than two years since European regulators blocked a bid for TNT by UPS.","FedEx Agrees to Acquire TNT Express in $4.8 Billion Deal","Business","American Express"
"2342",2,"2015-10-21T16:03:27+0000","After a dip in 2014, support for legalization is back up, tying the record level reached in 2013.","Facts & Figures: Majority of Americans Support Legal Marijuana","OpEd","American Express"
"2343",3,"2015-05-22T06:51:27+0000","The university expressed “indignation” at allegations that it had inappropriately benefited from the scientists’ alleged theft of technology from American companies.","Tianjin University’s Response to Professors’ Indictment in U.S.","Foreign","American Express"
"2344",4,"2015-07-02T07:00:00+0000","Naomi Harris has been on a trek to visit places where Europeans celebrate what they think is American culture, and vice versa.","Searching for America (in Europe)","","American Express"
"2345",5,"2015-02-13T19:31:10+0000","Severing an exclusive deal with the warehouse retailer has swiped some $8 billion in market value from the card company. Gains at MasterCard and Visa offset only part of that, note Rob Cox and Stephanie Rogan of Reuters Breakingviews.","Costco Customers May Come Out Ahead in Amex Divorce","Business","American Express"
"2346",6,"2015-07-31T20:04:38+0000","The European Commission said it had concerns that the $4.8 billion merger could decrease competition and lead to higher prices for consumers.","FedEx-TNT Express Deal to Be Investigated in Europe","Business","American Express"
"2347",7,"2015-11-13T01:33:50+0000","The Iranian president’s remarks, in an interview with an Italian newspaper, appeared at odds with those of Iran’s supreme leader, at least in tone.","Iran President Doesn’t Rule Out Normalized U.S. Ties One Day","Foreign","American Express"
"2348",8,"2015-09-10T23:52:32+0000","The Museum of Chinese in America exhibition will explore Mr. Lee’s designs for hundreds of buildings and interiors in New York and China.","The Architect Poy Gum Lee Finally Has a Retrospective","Weekend","American Express"
"2349",9,"2015-07-22T21:41:40+0000","Qualcomm lowers guidance, while American Express earnings beat forecasts. Stocks closed out the mid-week session lower. Bobbi Rebell reports.","Qualcomm cutting 15 pct of workforce","","American Express"
"2350",10,"2015-04-29T00:16:07+0000","Matthew Luke, formerly the network’s director of media and archive management, filed a lawsuit in New York Supreme Court claiming wrongful termination.","Sexism and Anti-Semitism Charged in Al Jazeera America Lawsuit","Business","American Express"
"2351",1,"2015-04-17T22:26:13+0000","As director and choreographer of “An American in Paris” at the Palace Theater, Mr. Wheeldon proves the power of wordless storytelling.","Christopher Wheeldon’s ‘An American in Paris’ Brings Ballet Values to Broadway","Culture","American Express"
"2352",2,"2015-04-29T00:16:07+0000","Matthew Luke, formerly the network’s director of media and archive management, filed a lawsuit in New York Supreme Court claiming wrongful termination.","Sexism and Anti-Semitism Charged in Al Jazeera America Lawsuit","Business","American Express"
"2353",3,"2015-01-06T18:43:38+0000","Industry forecasters predict Mexico, Canada and Britain as top choices.","Where Will Americans Travel in 2015?  ","Travel","American Express"
"2354",4,"2015-08-14T13:21:40+0000","As the U.S. prepares to raise the flag at its newly restored embassy in Havana, Cubans and Americans in Havana express excitement over the two nations' future. Nathan Frandino reports.","Flag-raising at U.S. embassy brings high hopes to Havana","","American Express"
"2355",5,"2015-08-17T11:26:57+0000","Netanyahu makes another unsubtle pitch for Congress to undermine Obama.","Iran and American Jews","OpEd","American Express"
"2356",6,"2015-04-16T22:49:04+0000","American Express reported a better-than-expected rise in quarterly profit; Schlumberger is cutting more jobs; Mattel stock rises on turnaround optimism. Bobbi Rebell reports.","Amex profit beat; Schlumberger job cuts","","American Express"
"2357",7,"2015-09-21T20:01:59+0000","Muslim advocates called for Ben Carson to leave the presidential race after saying that he was opposed to a Muslim being president.","Ben Carson’s Comments Stir Anger Among Muslims","Politics","American Express"
"2358",8,"2015-03-01T10:05:01+0000","Highlights from the International Herald Tribune archives: Americans respond to the vessel’s seizure in 1915.","1915: Americans Are Glad French, Not British, Warship Captures Dacia","Foreign","American Express"
"2359",9,"2015-09-14T10:22:44+0000","Europe is done with greatness. Been there, tried that. But America can't live without it.","America Is Great","Editorial","American Express"
"2360",10,"2015-12-19T17:12:45+0000","Defense Secretary Ashton B. Carter did not offer a detailed explanation for the errant airstrike, which the Iraqi government said killed at least nine Iraqi soldiers, but said, “It seemed to be a mistake that involved both sides.”","U.S. Airstrike Killed Iraqis by Accident, Officials Say","Foreign","American Express"
"2361",1,"2015-06-03T00:59:10+0000","The relatives of four United States citizens were pressing the Obama administration to do more to free the captives before the June 30 deadline for reaching an international agreement to limit Iran’s nuclear program.","Families Tell Lawmakers of Americans Held Hostage in Iran","Foreign","American Express"
"2362",2,"2015-01-20T14:30:15+0000","Seth Rogen and others call out the film on a variety of counts.","That Fake Baby and Other ‘American Sniper’ Issues","Culture","American Express"
"2363",3,"2015-08-24T05:24:31+0000","Quotation of the Day for Monday, August 24, 2015","Quotation of the Day for Monday, August 24, 2015","Summary","American Express"
"2364",4,"2015-11-09T21:56:58+0000","People in countries with high levels of carbon emissions are actually less concerned about climate change than people in low-emission countries.","Facts & Figures: Where People Worry About Climate Change","OpEd","American Express"
"2365",5,"2015-12-01T05:28:26+0000","Express Scripts is expected to promote a compounded medicine with the same active ingredient as the much more expensive Turing Pharmaceuticals drug Daraprim.","Top Prescription Plan to Offer $1 Alternative to $750 Pill","Business","American Express"
"2366",6,"2015-08-30T22:10:23+0000","In a daylong visit to Pakistan, the national security adviser urged leaders to stop militants from using Pakistani territory to stage attacks in Afghanistan.","Susan Rice, Obama’s Security Adviser, Urges Pakistan to Do More Against Militants","Foreign","American Express"
"2367",7,"2015-10-02T01:06:40+0000","Saeed Abedini, the Iranian-American pastor serving an eight-year prison term in Iran on charges of undermining national security, could face additional charges.","Iran: U.S. Detainee May Face More Charges","Foreign","American Express"
"2368",8,"2015-01-07T23:44:41+0000","Saying that the United States could not be trusted to lift sanctions, Ayatollah Ali Khamenei said that Iran should find internal solutions to economic problems.","Iran’s Supreme Leader Is Skeptical of Nuclear Talks With U.S.","Foreign","American Express"
"2369",9,"2015-02-18T16:02:31+0000","Members of Congress might be home for the President’s Day recess but they cannot avoid the debate over trade.","Trade Group Accelerates Push for a ‘Fast Track’ Deal","","American Express"
"2370",10,"2015-06-02T11:00:05+0000","Most Americans say that money has too much of an influence on politicians and that campaign finance changes are needed.","Americans’ Views on Money in Politics","U.S.","American Express"
"2371",1,"2015-06-23T13:36:16+0000","It’s a Klan thing.","More on Slavery’s Shadow","OpEd","American Express"
"2372",2,"2015-04-04T00:42:45+0000","The families of three Americans of Iranian descent who are incarcerated in Iran have been hoping that a nuclear accord will prompt Iran to release them.","Fates of 3 Americans Held in Iran Remain Hazy Despite Diplomatic Progress","Foreign","American Express"
"2373",3,"2015-03-04T20:25:52+0000","Wednesday’s oral argument provided few clues, but a surprise came from Justice Anthony Kennedy.","The Supreme Court and the Fate of American Health Care","Editorial","American Express"
"2374",4,"2015-12-29T08:21:04+0000","The Senate’s refusal to approve a dozen ambassador nominees threatens our national interest.","America’s Empty Embassies","OpEd","American Express"
"2375",5,"2015-09-20T17:46:49+0000","The White House announced that the two men were freed along with a British citizen and three Saudis, all of whom had been held by Houthi rebels.","2 Americans Among 6 Hostages Freed in Yemen After Months of Captivity","Foreign","American Express"
"2376",6,"2015-08-04T21:46:33+0000","Jeb Bush suggested that Donald J. Trump’s strategy was to “prey” on the “fear and angst” of the American electorate, and Mr. Bush reiterated his view that many illegal border crossings by migrant parents were “an act of love.”","Jeb Bush Cautions Donald Trump on Preying on Voters’ ‘Fear and Angst’","Politics","American Express"
"2377",7,"2015-08-06T02:48:45+0000","The survey by the Pew Research Center was conducted the week after a July 10 ceremony in Columbia, S.C., in which the battle flag was lowered and sent to a museum.","Most Americans Support South Carolina’s Removal of Rebel Flag, Poll Says","National","American Express"
"2378",8,"2015-09-24T01:09:37+0000","Mr. Xi, at Microsoft headquarters, heard criticism of his government’s laws and practices that discriminate against American corporate operations in China.","Xi Jinping Hears Tough Complaints of American Business","Foreign","American Express"
"2379",9,"2015-05-08T20:24:33+0000","These cards are popular with reward seekers, but making them profitable for issuers has been difficult. Now four companies are trying them again.","Credit Cards With 2% Rebates, While (or if) They Last","Business","American Express"
"2380",10,"2015-12-17T13:30:15+0000","Delayed? Have some time between flights? What to do (and where to eat, do yoga, or charge your phone) at 10 major American airports during the busy travel season.","How to Navigate America’s Busiest Airports","Travel","American Express"
"2381",1,"2015-12-17T13:30:15+0000","Delayed? Have some time between flights? What to do (and where to eat, do yoga, or charge your phone) at 10 major American airports during the busy travel season.","How to Navigate America’s Busiest Airports","Travel","American Express"
"2382",2,"2015-07-19T21:13:53+0000","Recent attempts to shorten travel time for residents who rely on buses the most appear to work, but the city still has a long way to go.","Express Bus Service Shows Promise in New York","Culture","American Express"
"2383",3,"2015-12-21T12:37:41+0000","A Taliban suicide bomber on a motorcycle struck a patrol near Bagram Air Base, in one of the deadliest attacks against American forces this year.","6 American Soldiers Killed in Taliban Attack in Afghanistan","Foreign","American Express"
"2384",4,"2015-07-16T07:21:21+0000","A new security law promises to be more oppressive than the last, and American officials are missing their chance to put pressure on Cairo.","With Washington’s Complicity, Egypt Cracks Down on Critics","Editorial","American Express"
"2385",5,"2015-03-17T10:38:49+0000","One obstacle has been the banks’ own reluctance to press Apple for fear of upsetting their relationships with the tech giant.","Daily Report: Apple Pay and Banks Tussle Over Fraud","Business","American Express"
"2386",6,"2015-05-12T05:29:10+0000","Corrections appearing in print on Tuesday, May 12, 2015.","Corrections: May 12, 2015","Summary","American Express"
"2387",7,"2015-04-30T18:32:17+0000","Prime Minister Shinzo Abe has begun to address Japan’s occupation of China and Korea, but critics say he must do more.","War, Repentance and Japan","OpEd","American Express"
"2388",8,"2015-08-22T16:21:08+0000","A suicide car bomber targeted the vehicle of the Americans, employees of the military contractor DynCorp International, according to Afghan and American accounts.","Kabul Suicide Bombing Kills 12, Including 3 Americans","Foreign","American Express"
"2389",9,"2015-12-17T11:00:56+0000","Most people in the United States describe themselves as very concerned about the threat of terrorism, but considerably fewer worry about a mass shooting taking place where they live, according to a New York Times/CBS News poll.","Poll Watch: Americans Fear More Terrorist Attacks but Have Mixed Views on Gun Control","Politics","American Express"
"2390",10,"2015-02-03T22:30:14+0000","ABC’s “Fresh Off the Boat,” based on the restaurateur Eddie Huang’s memoir, is the first network sitcom centered on an Asian-American family in two decades.","An Immigrant’s Tale, With All-American Tropes ","Culture","American Express"
"2391",1,"2015-07-20T09:27:25+0000","The strike in the eastern province of Logar, which killed at least seven Afghan soldiers, is under investigation, an American military spokesman said.","Attack by U.S. Helicopters Kills Afghan Troops, Officials Say","Foreign","American Express"
"2392",2,"2015-01-19T00:15:11+0000","This holiday does not fully belong in the most profound ways to many Americans, and to some, it does not belong at all.","What, To the Black American, Is Martin Luther King Jr. Day?","OpEd","American Express"
"2393",3,"2015-09-21T10:38:37+0000","After a period of estrangement, King Salman’s visit to Washington was a sign of renewed cooperation.","A Saudi-American Reset","OpEd","American Express"
"2394",4,"2015-11-17T11:00:34+0000","Gov. John Kasich of Ohio said in September that it was America’s responsibility to take in Syrians on humanitarian grounds. But after the Paris attacks, he sent a note to President Obama requesting that no additional refugees be settled in Ohio.","John Kasich Shifts His Stand on Accepting Refugees","Politics","American Express"
"2395",5,"2015-07-30T21:59:57+0000","The dispute over one of the world’s busiest trade routes has emerged as a serious point of contention between the two countries ahead of several crucial meetings.","China Blames U.S. Military Actions for Tensions in the South China Sea","Foreign","American Express"
"2396",6,"2015-03-29T04:19:10+0000","The couple were married at Liberty House in Jersey City.","Amy Farkas, Samuel Levy","Society","American Express"
"2397",7,"2015-11-19T16:44:10+0000","Some have drawn a parallel between those fleeing Syria today and Jews who left Nazi Germany. But are those comparisons accurate?","Comparing Jewish Refugees of the 1930s With Syrians Today","National","American Express"
"2398",8,"2015-08-17T16:58:33+0000","From the International Herald Tribune archives: The United States is furious at German conspirators in 1915.","1915: U.S. Angered by German Plots","Foreign","American Express"
"2399",9,"2015-06-25T09:45:03+0000","What you need to know if you’re on a trip or planning one soon, including live music on a train to the Montreal International Jazz Festival and an Agatha Christie celebration in Istanbul.","Thursday’s Travel News and Tips","Travel","American Express"
"2400",10,"2015-05-06T23:03:28+0000","Even though many programs stipulate that miles and points can’t be transferred after a death or divorce, exceptions can be made if a person makes a good case.","Loyalty Program Rules Aren’t Ironclad","Business","American Express"
"2401",1,"2015-01-28T00:03:46+0000","President Obama and Prime Minister Narendra Modi have set relations between their democracies on a deeper path.","A New Chapter for America and India","Editorial","American Express"
"2402",2,"2015-05-06T23:03:28+0000","Even though many programs stipulate that miles and points can’t be transferred after a death or divorce, exceptions can be made if a person makes a good case.","Loyalty Program Rules Aren’t Ironclad","Business","American Express"
"2403",3,"2015-06-24T20:38:56+0000","I’m all for celebrating the drawing down of the flag, but now let’s pivot from symbolic moves to substantial ones.","Tearing Down the Confederate Flag Is Just a Start","OpEd","American Express"
"2404",4,"2015-12-18T03:03:31+0000","The deal, in a huge digital market, may give a boost to Apple Pay, which lets users pay for goods by holding a mobile device near a credit card reader.","Apple Pay Is Set to Arrive in China","Business","American Express"
"2405",5,"2015-04-12T11:43:37+0000","The American ambassador to Iraq had expressed his dissatisfaction that Shiite militiamen were in the thick of a local offensive against Islamic State.","U.S. Steps Up Bombing Raids in Anbar After Shiite Militias Withdraw","Foreign","American Express"
"2406",6,"2015-03-26T16:38:02+0000","The Israeli Prime Minister is walking back from his comments about Arab voters, but he’ll have to do more than that.","Taking Netanyahu Seriously","OpEd","American Express"
"2407",7,"2015-05-15T02:36:36+0000","Amir Hekmati, the Marine veteran who is the longest-held American prisoner in Iran, reluctantly ended his 10-day hunger strike when family members asked him to stop.","Marine Veteran Held in Iranian Prison Ends Hunger Strike at Family’s Request","Foreign","American Express"
"2408",8,"2015-01-23T14:58:06+0000","President Obama and Prime Minister Narendra Modi will discuss climate change, energy issues and business opportunities for American companies in India.","U.S. and India Appear Ready to Try to Hash Out Differences","Foreign","American Express"
"2409",9,"2015-04-21T15:59:49+0000","Want to rack up frequent-flier miles and loyalty points quickly and easily? Here’s a primer on the best newcomers and evergreens.","Finding the Right Credit Card, No Matter How Much You Travel","Travel","American Express"
"2410",10,"2015-08-25T22:03:18+0000","The messages of support from Iranian human rights activists are a new element in the emotional campaigns for and against the deal in the United States.","On YouTube, Iran Activists Urge America to Back Nuclear Deal","Foreign","American Express"
"2411",1,"2015-07-31T14:10:50+0000","In a speech in Florida to a largely black audience at the annual meeting of the National Urban League, Hillary Rodham Clinton derided the policies and proposals of Jeb Bush, a former governor of the state.","Hillary Clinton Suggests Jeb Bush Has Hurt Black Americans’ Cause","Politics","American Express"
"2412",2,"2015-06-30T11:00:05+0000","For millions of mixed-race people, identity fits more than one box, but we still see one another in black and white.","America’s ‘Postracial’ Fantasy","Magazine","American Express"
