"","id","created_time","snippet","headline","news_desk","company_name"
"739",9,"2010-05-20T17:01:05+0000","Google TV promises to integrate the Web and TV, but it relies on TV manufacturers to use its software.","Calling on Sony and Others, Google Makes a TV Move","Business","Intel"
"740",10,"2010-05-20T15:26:45+0000","Following Google’s announcements about its Android mobile phone operating system and its new Google TV platform.","Google’s Announcement of a Push Into TV","Business","Intel"
"741",1,"2010-05-14T01:44:35+0000","Chuck McMinn, a former Intel manager turned winemaker, helps start a hiking and biking path through the Napa wine country.","A High-Tech Mogul’s Low-Tech Wine Trail","Dining","Intel"
"742",2,"2010-05-17T06:06:16+0000","A smorgasbord of more professional video content appears to be turning YouTube — considered by many to be a risky investment when it was bought for $1.65 billion at the end of 2006 — into one of Google’s smartest acquisitions.","YouTube: Google’s Smartest Buy?","Business","Intel"
"743",3,"2010-04-14T20:15:55+0000","After Intel’s positive first-quarter results, analysts say the PC market could grow by as much as 25 percent this year.","PC Sales Are on Course for Big Increase in 2010","Business","Intel"
"744",4,"2010-05-07T02:47:35+0000","Mr. Palevsky was the founder of Intel, art collector and a major contributor to Democratic presidential politics.","Max Palevsky, a Pioneer in Computers, Dies at 85","National","Intel"
"745",5,"2010-07-23T01:09:46+0000","The Securities and Exchange Commission accused Dell of misleading investors by using money it had received from Intel to pad its quarterly earnings statements.","Dell to Pay $100 Million Settlement","Business","Intel"
"746",6,"2010-02-16T18:37:56+0000","Intel and Nokia have gambled that Qt – pronounced “cute” – will win the hearts of software creators and then win the mobile wars.","That Smartphone Is So Qt","Business","Intel"
"747",7,"2010-04-01T18:03:36+0000","John Doerr’s decision to step down from the Amazon board came amid an inquiry by the F.T.C. into the interlocking ties between Amazon and Apple.","F.T.C. Is Said to Have Looked Into Amazon-Google Ties","Business","Intel"
"748",8,"2010-02-24T10:22:14+0000","Intel and 24 venture capital firms said Tuesday that they planned to invest $3.5 billion in American start-ups over the next two years in an effort to keep America competitive in technology education and innovation, The New York Times reported.","A $3.5 Billion Effort Aims to Help Tech Start-Ups","Business","Intel"
"749",9,"2010-02-24T01:09:04+0000","Intel is leading an initiative to add jobs and spur innovation to keep the U.S. ahead of nations like China and India.","A $3.5 Billion Effort Aims to Help Tech Start-Ups","Business","Intel"
"750",10,"2010-02-22T01:11:29+0000","Intel and its rivals are in a race to dominate a growing market for small mobile devices with chips that are inexpensive and use little power.","For Chip Makers, the Next Battle Is in Smartphones","Business","Intel"
"751",1,"2010-02-22T01:11:29+0000","Intel and its rivals are in a race to dominate a growing market for small mobile devices with chips that are inexpensive and use little power.","For Chip Makers, the Next Battle Is in Smartphones","Business","Intel"
"752",2,"2010-05-19T16:07:27+0000","I.B.M. has agreed to put Nvidia’s Tesla graphics chips in one of its mainstream server computers – a big win for Nvidia and a blow to Intel.","Nvidia Finds a Friend in I.B.M.","Business","Intel"
"753",3,"2010-03-11T17:00:53+0000","Betaworks, the start-up incubator that helped spawn TweetDeck and Bit.ly, raises $20 million.","Investors Bet on Betaworks, a New York Tech Incubator","Business","Intel"
"754",4,"2010-02-15T18:17:57+0000","Joaquín Almunia, the E.U.'s new commissioner for competition policy, warned Monday that despite the weak economy, companies would continue to face high fines if they break antitrust law.","E.U. Will Maintain Strict Policy on Antitrust Behavior, Official Says","Business","Intel"
"755",5,"2010-09-02T17:08:05+0000","A new Windows PC comes covered with advertising stickers even though computer companies are trying to make their laptops beautiful. They ought to stop.","Laptops Look Like Racecars — and Not in a Good Way","","Intel"
"756",6,"2010-02-09T01:46:14+0000","Rajiv Goel said that in 2007 he provided the hedge fund founder Raj Rajaratnam with confidential tips about Intel and Sprint Nextel.","Insider’s Admission Deepens Galleon Case","Business","Intel"
"757",7,"2010-03-21T00:56:14+0000","Seeing the 40 finalists in the 2010 Intel science contest is a reminder of how great our nation can be with a constant flow of legal immigrants.","America’s Real Dream Team","Editorial","Intel"
"758",8,"2010-04-13T22:06:09+0000","Apple is selling new notebook computers with the ability to toggle between processors.","Apple Refreshes MacBooks","","Intel"
"759",9,"2010-03-03T01:49:01+0000","A talk with the chief of Intel suggests that the U.S. needs to focus more on competitiveness in the global marketplace.","A Word From the Wise","Editorial","Intel"
"760",10,"2010-08-20T07:36:24+0000","Mega-deal activity in equities markets this week has spurred speculation of what companies might be the next takeover candidates, resulting in unusually large volume in the U.S. options market for several stocks, including Symantec Corp and U.S. S...","Options Traders Search for Takeover Targets","Business","Intel"
"761",1,"2010-08-02T19:00:50+0000","Stress and frustration caused by slow computers.","Hourglass Syndrome","","Intel"
"762",2,"2010-10-19T17:57:48+0000","Just so you know, the Citigroup chairman has a leather jacket that works. It does.","Citi’s Parsons Has a Leather Jacket That ‘Works’","Business","Intel"
"763",3,"2010-02-15T15:06:14+0000","Microsoft unveiled a new version of its flagship smartphone software, now called Windows Phone.","Microsoft Starts Over in Phone Software","Business","Intel"
"764",4,"2010-05-10T20:19:24+0000","The Washington Post’s  ombudsman wrote that its editors have concluded that the reported online swapping of the president’s photo with one of Malcolm X probably never happened.","Photo Mix-up With Obama Is Called Hoax","Business","Intel"
"765",5,"2010-02-08T20:17:48+0000","A former executive of Intel became the 10th person to plead guilty in the Galleon Group insider trading case after admitting in court on Monday afternoon that he had passed confidential corporate information to Galleon’s founder, Raj Rajaratnam.","10th Person in Galleon Insider Case Pleads Guilty","","Intel"
"766",6,"2010-04-16T03:33:07+0000","The earnings added to evidence that personal-computer demand is increasing.","A.M.D. Posts Profit as Sales Rise by 34%","Business","Intel"
"767",7,"2010-06-24T16:36:27+0000","A bouquet of computer laptop choices from Acer.","Acer Lines ‘Em Up","","Intel"
"768",8,"2010-01-26T20:56:07+0000","Prosecutors in the insider trading case surrounding the Galleon Group told a federal judge Tuesday that Mark Kurland, a co-founder of New Castle Funds, had waived an indictment, an indication he intends to plead guilty in the case.","New Castle Exec to Plead Guilty in Galleon Case","","Intel"
"769",9,"2010-07-22T22:41:51+0000","Michael Dell is forced to pay $4 million — from his own pocket.","Could This Be a Real Deterrent?","Business","Intel"
"770",10,"2010-03-13T23:01:56+0000","Fiber optic links may soon help consumer gadgets and computers communicate with each other at ultrahigh speeds.","An Express Lane From Camera to Computer","SundayBusiness","Intel"
"771",1,"2010-12-30T00:41:09+0000","A couple of H.P. laptops use Intel’s new Sandy Bridge chip.","H.P. Previews Intel’s New Chip","","Intel"
"772",2,"2010-12-08T15:29:54+0000","The chip giant Intel has formed a new business group dedicated to tackling nontraditional PCs.","Intel Girds For Netbook and Tablet Wars","","Intel"
"773",3,"2010-11-25T19:39:00+0000","Ireland plans to keep low rates that have attracted Microsoft, Intel and Pfizer but that other countries say distort competition.","In Ireland, Low Corporate Taxes Go Untouched","Business","Intel"
"774",4,"2010-11-01T07:00:15+0000","The move thrusts Intel, the largest and wealthiest chip maker, into the contract manufacturing business dominated by Taiwanese and Chinese companies.","Intel Takes a Wider Role, Making Chips for Others","Business","Intel"
"775",5,"2010-10-19T18:38:59+0000","Intel said it plans to invest $6 billion to $8 billion to upgrade plants in the U.S., adding as many as 1,000 new high-tech positions and thousands of construction jobs.","Intel to Build New Chip Plant in Oregon, and Upgrade Others","Business","Intel"
"776",6,"2010-10-13T01:28:08+0000","Intel has established one of the most well-known brands, but some new products make little mention of the company.","Intel Tries Anonymity, for a Change","Business","Intel"
"777",7,"2010-10-15T21:14:58+0000","Two new television sets feature remotes that aim to make navigating entertainment options easier.","A Tale of Two Remotes","","Intel"
"778",8,"2010-10-01T22:47:26+0000","The total value of technology deals in the third quarter fell 26 percent from second quarter, although it was up 21 percent from the depressed third quarter of 2009.","Tech Deals Percolate, but There’s No M.&A. Boom","Business","Intel"
"779",9,"2010-10-01T09:20:53+0000","Three top executives of Sprint Nextel resigned from the board of its Clearwire venture, stoking speculation it would pave the way for a wholesale deal or equity stake sale to T-Mobile USA.","Clearwire Resignations Spark Chatter","Business","Intel"
"780",10,"2010-09-25T00:38:50+0000","The antitrust settlement promises to increase the competition for sought-after technology workers.","Six Technology Firms Agree to More Hiring Competition","Business","Intel"
"781",1,"2010-09-09T23:36:48+0000","A fresh chip design from ARM could pave the way for the smartphone specialist to enter the data center.","ARM Mounts Next Offensive Against Intel","","Intel"
"782",2,"2010-09-20T01:21:05+0000","ARM, which designs low-power chips, commands a prime position amid one of the next technological revolutions.","British Chip Designer Prepares for Wider Demand","Business","Intel"
"783",3,"2010-09-18T01:06:02+0000","A number of Silicon Valley companies including Apple, Google and Intel are being investigated over agreements not to recruit each other’s employees.","Tech Firms Said to Be in Talks to Settle Inquiry Over Recruiting","Business","Intel"
"784",4,"2010-08-30T21:24:34+0000","The deal would give Intel a foothold in the smartphone chip market, a segment of the wireless business that is experiencing strong growth.","Intel to Buy a Wireless Division of Infineon","Business","Intel"
"785",5,"2010-08-30T02:23:51+0000","A deal would give Intel a foothold in the market for smartphone chips, a segment that is experiencing double-digit annual growth.","Intel Is Close to Acquisition of Infineon Wireless Unit","Business","Intel"
"786",6,"2010-08-30T08:10:39+0000","Intel’s announcement on Monday came less than two weeks after saying that it would acquire McAfee.","Intel to Buy Infineon Wireless Unit for $1.4 Billion","Business","Intel"
"787",7,"2010-08-30T05:29:17+0000","Less than two weeks after Intel said it would buy McAfee, the company announced Monday that it would acquire the German chipmaker Infineon’s wireless business for about $1.4 billion in cash.","Intel to Acquire Infineon Wireless Unit","Business","Intel"
"788",8,"2010-08-26T20:02:14+0000","Intel is reportedly interested in buying Infineon Technologies’ wireless business.","Intel Said to Be Near Deal for Infineon Wireless Unit","Business","Intel"
"789",9,"2010-08-23T16:58:28+0000","The former president of McAfee offers a contrarian view of what makes sense about the Intel-McAfee deal, and what doesn’t.","A Different Take on the Intel-McAfee Deal","Business","Intel"
"790",10,"2010-08-23T19:28:57+0000","A former president of McAfee offers a contrarian view of what makes sense about the Intel-McAfee deal, and what does not.","A Different Take on the Intel-McAfee Deal","Business","Intel"
"791",1,"2010-08-20T08:37:22+0000","Intel is betting that combining McAfee’s security software with its hardware will give it a leg up. But investors who knocked down Intel’s shares are rightly skeptical the chip maker can pull it off.","For Intel, a Merger of Fish and Fowl","Business","Intel"
"792",2,"2010-08-20T02:26:06+0000","Intel’s $7.7 billion deal to buy the security firm McAfee is a surprising gamble when hardware and software makers don’t often crossover successfully.","For Intel, a Merger Of Fish and Fowl","Business","Intel"
"793",3,"2010-08-19T13:39:01+0000","With the $7.68 billion acquisition Intel becomes a major player in the security software and services market.","With McAfee Deal, Intel Looks for Edge","Business","Intel"
"794",4,"2010-08-19T12:29:25+0000","The chip giant is paying a roughly 60 percent premium for McAfee to expand its presence in security services.","Intel to Buy McAfee for $7.7 Billion","Business","Intel"
"795",5,"2010-08-16T06:20:33+0000","Smooth-Stone, a semiconductor start-up, has pulled in $48 million from an international group of investors in a bid to disrupt one of Intel’s most lucrative franchises: server chips.","A Chip Start-Up Aims to Slay Intel","Business","Intel"
"796",6,"2010-08-27T03:31:03+0000","Cash, caution and skepticism make expectations of a merger and acquisition boom look overdone.","Looking Askance at Acquisitions","Business","Intel"
"797",7,"2010-08-26T20:36:37+0000","Via a new software platform, Broadcom looks to make it easier for software makers to link our gadgets and share files. Intel is working on a similar solution.","Broadcom Pitches Lingua Franca for PCs, TVs and Tablets","Business","Intel"
"798",8,"2010-08-25T21:31:20+0000","Sure, Hewlett-Packard appears to have made an aggressive play by trumping Dell’s bid for 3Par. But one technology analyst wonders why H.P. did not try to steal McAfee away from Intel instead.","Should H.P. Dump Its 3Par Bid for McAfee?","Business","Intel"
"799",9,"2010-08-04T14:29:14+0000","The chip maker Intel agreed to change some practices under a settlement with the Federal Trade Commission.","Intel Settles With F.T.C. On Antitrust","Business","Intel"
"800",10,"2010-08-04T02:41:26+0000","The commission accused Intel of illegally using its dominance to block customers from buying competitors’ products.","Intel to Settle F.T.C. Antitrust Case","Business","Intel"
"801",1,"2010-08-04T02:41:26+0000","The commission accused Intel of illegally using its dominance to block customers from buying competitors’ products.","Intel to Settle F.T.C. Antitrust Case","Business","Intel"
"802",2,"2010-08-02T23:31:41+0000","The venture will focus on products that help the elderly and those with chronic diseases to live independently.","G.E. and Intel Form Health Venture","Business","Intel"
"803",3,"2010-08-19T20:31:57+0000","This week has been busiest for deals in August since August 2006, Thomson Reuters says.","No Dog Days in Deal Land","Business","Intel"
"804",4,"2010-08-19T18:14:13+0000","Intel’s $7.68 billion takeover deal for McAfee overshadowed another bit of eye-catching news from the antivirus software maker — namely, that Cameron Diaz was the most dangerous celebrity name online.","Meanwhile, in Other Big News From McAfee. . .","Business","Intel"
"805",5,"2010-08-15T22:19:21+0000","A start-up wants to modify low-power smartphone chips to run servers, the computers in corporate data centers. If successful, it would undermine Intel’s server-chip juggernaut.","Start-Up Aims to Slay Chip Goliath","Business","Intel"
"806",6,"2010-07-24T00:20:28+0000","E-mails released by the S.E.C. show how hard it was for Dell executives to give up rewards doled out by Intel for remaining a one chip shop.","Dell’s Trouble Kicking the Intel Habit","Business","Intel"
"807",7,"2010-07-12T01:03:23+0000","The F.T.C. has an opportunity to reach a settlement in the litigation over Intel’s dominance in the microchip industry. It is crucial that the agency get it right.","Settling With Intel","Editorial","Intel"
"808",8,"2010-07-13T20:44:02+0000","Revenue rose 34 percent for the chip maker Intel, which posted net income of $2.9 billion.","Citing Demand, Intel Tops Forecast","Business","Intel"
"809",9,"2010-08-09T09:13:51+0000","Plastic Logic of Britain is in discussions with Russia’s state-controlled Rusnano, a nanotechnology corporation, to provide a capital infusion that would give it ownership of the company. According to The Financial Times, the move is “likely to fu...","Deal for Plastic Logic Could Fan British Fears","Business","Intel"
"810",10,"2010-08-07T01:18:10+0000","The settlement between the F.T.C. and Intel stands a good chance of curtailing the company’s tactics to keep its dominance of the microchip market.","A Worthy Chip Deal","Editorial","Intel"
"811",1,"2010-07-14T05:49:08+0000","Asian stock markets jumped Wednesday, powered by better-than-expected earnings from chipmaking giant Intel and Singapore’s forecast that its economy will grow a blistering 15 percent this year.","Asian Stocks Up, Powered by Intel and Singapore","Business","Intel"
"812",2,"2010-08-04T20:52:00+0000","In 2009, companies spent more than $47 billion on custom marketing — from magazines to Web sites — to attract specific audiences.","Vice, a Media Company, Shows Big Brands How to Reach the Hip Crowd","Business","Intel"
"813",3,"2010-07-07T15:05:55+0000","Intel’s event recorder for automobiles would use GPS, sensors and video cameras to recreate accidents.","Intel Working on Black Box for Your Car","","Intel"
"814",4,"2010-07-27T09:06:40+0000","General Electric announced that it will invest in a $5 million round for SynapSense, a start-up that makes wireless sensor technology and software to monitor and reduce power usage and cooling in data centers, GigaOm reported.","G.E. Invests in Green Data Center Start-Up","Business","Intel"
"815",5,"2010-06-10T22:10:18+0000","The computer company and its founder, Michael S. Dell, are accused of financial irregularities stemming from dealings with the chip maker.","Dell in Talks to Settle Intel Claims With S.E.C.","Business","Intel"
"816",6,"2010-07-26T16:32:36+0000","White Collar Watch examines how the Dodd-Frank Act, now law, enables the Securities and Exchange Commission to encourage whistle-blowers who reveal a broad array of securities fraud.","Come Blow Your Horn for the S.E.C.","","Intel"
"817",7,"2010-07-22T20:47:42+0000","Dell agreed to pay $100 million to settle S.E.C. charges that its senior executives used fraudulent accounting tricks to make it appear that it was meeting Wall Street earnings targets.","Dell Settles S.E.C. Accounting Suit for $100 Million","Business","Intel"
"818",8,"2010-06-11T08:58:50+0000","Dell said on Thursday that it was in talks with the Securities and Exchange Commission to resolve allegations that it and its founder and chief executive, Michael S. Dell, engaged in financial irregularities related to the company’s dealings with ...","Dell in Talks With S.E.C. to Settle Intel Claims","Business","Intel"
"819",9,"2010-06-21T23:45:26+0000","Over the next month, Intel and the Federal Trade Commission will discuss reaching some sort of settlement in a case brought against Intel last year.","Intel and F.T.C. Agree to Talk","Business","Intel"
"820",10,"2010-06-22T09:48:31+0000","Intel has reached a legal cease-fire with the Federal Trade Commission over a complaint that the company abused its position in the chip market.","Intel and F.T.C. Agree to Talk","Business","Intel"
"821",1,"2010-12-30T00:41:09+0000","A couple of H.P. laptops use Intel’s new Sandy Bridge chip.","H.P. Previews Intel’s New Chip","","Intel"
"822",2,"2010-12-08T15:29:54+0000","The chip giant Intel has formed a new business group dedicated to tackling nontraditional PCs.","Intel Girds For Netbook and Tablet Wars","","Intel"
"823",3,"2010-11-25T19:39:00+0000","Ireland plans to keep low rates that have attracted Microsoft, Intel and Pfizer but that other countries say distort competition.","In Ireland, Low Corporate Taxes Go Untouched","Business","Intel"
"824",4,"2010-11-01T07:00:15+0000","The move thrusts Intel, the largest and wealthiest chip maker, into the contract manufacturing business dominated by Taiwanese and Chinese companies.","Intel Takes a Wider Role, Making Chips for Others","Business","Intel"
"825",5,"2010-10-19T18:38:59+0000","Intel said it plans to invest $6 billion to $8 billion to upgrade plants in the U.S., adding as many as 1,000 new high-tech positions and thousands of construction jobs.","Intel to Build New Chip Plant in Oregon, and Upgrade Others","Business","Intel"
"826",6,"2010-10-13T01:28:08+0000","Intel has established one of the most well-known brands, but some new products make little mention of the company.","Intel Tries Anonymity, for a Change","Business","Intel"
"827",7,"2010-10-15T21:14:58+0000","Two new television sets feature remotes that aim to make navigating entertainment options easier.","A Tale of Two Remotes","","Intel"
"828",8,"2010-10-01T22:47:26+0000","The total value of technology deals in the third quarter fell 26 percent from second quarter, although it was up 21 percent from the depressed third quarter of 2009.","Tech Deals Percolate, but There’s No M.&A. Boom","Business","Intel"
"829",9,"2010-10-01T09:20:53+0000","Three top executives of Sprint Nextel resigned from the board of its Clearwire venture, stoking speculation it would pave the way for a wholesale deal or equity stake sale to T-Mobile USA.","Clearwire Resignations Spark Chatter","Business","Intel"
"830",10,"2010-09-25T00:38:50+0000","The antitrust settlement promises to increase the competition for sought-after technology workers.","Six Technology Firms Agree to More Hiring Competition","Business","Intel"
"831",1,"2010-09-09T23:36:48+0000","A fresh chip design from ARM could pave the way for the smartphone specialist to enter the data center.","ARM Mounts Next Offensive Against Intel","","Intel"
"832",2,"2010-09-20T01:21:05+0000","ARM, which designs low-power chips, commands a prime position amid one of the next technological revolutions.","British Chip Designer Prepares for Wider Demand","Business","Intel"
"833",3,"2010-09-18T01:06:02+0000","A number of Silicon Valley companies including Apple, Google and Intel are being investigated over agreements not to recruit each other’s employees.","Tech Firms Said to Be in Talks to Settle Inquiry Over Recruiting","Business","Intel"
"834",4,"2010-08-30T21:24:34+0000","The deal would give Intel a foothold in the smartphone chip market, a segment of the wireless business that is experiencing strong growth.","Intel to Buy a Wireless Division of Infineon","Business","Intel"
"835",5,"2010-08-30T02:23:51+0000","A deal would give Intel a foothold in the market for smartphone chips, a segment that is experiencing double-digit annual growth.","Intel Is Close to Acquisition of Infineon Wireless Unit","Business","Intel"
"836",6,"2010-08-30T08:10:39+0000","Intel’s announcement on Monday came less than two weeks after saying that it would acquire McAfee.","Intel to Buy Infineon Wireless Unit for $1.4 Billion","Business","Intel"
"837",7,"2010-08-30T05:29:17+0000","Less than two weeks after Intel said it would buy McAfee, the company announced Monday that it would acquire the German chipmaker Infineon’s wireless business for about $1.4 billion in cash.","Intel to Acquire Infineon Wireless Unit","Business","Intel"
"838",8,"2010-08-26T20:02:14+0000","Intel is reportedly interested in buying Infineon Technologies’ wireless business.","Intel Said to Be Near Deal for Infineon Wireless Unit","Business","Intel"
"839",9,"2010-08-23T16:58:28+0000","The former president of McAfee offers a contrarian view of what makes sense about the Intel-McAfee deal, and what doesn’t.","A Different Take on the Intel-McAfee Deal","Business","Intel"
"840",10,"2010-08-23T19:28:57+0000","A former president of McAfee offers a contrarian view of what makes sense about the Intel-McAfee deal, and what does not.","A Different Take on the Intel-McAfee Deal","Business","Intel"
"841",1,"2010-08-20T08:37:22+0000","Intel is betting that combining McAfee’s security software with its hardware will give it a leg up. But investors who knocked down Intel’s shares are rightly skeptical the chip maker can pull it off.","For Intel, a Merger of Fish and Fowl","Business","Intel"
"842",2,"2010-08-20T02:26:06+0000","Intel’s $7.7 billion deal to buy the security firm McAfee is a surprising gamble when hardware and software makers don’t often crossover successfully.","For Intel, a Merger Of Fish and Fowl","Business","Intel"
"843",3,"2010-08-19T13:39:01+0000","With the $7.68 billion acquisition Intel becomes a major player in the security software and services market.","With McAfee Deal, Intel Looks for Edge","Business","Intel"
"844",4,"2010-08-19T12:29:25+0000","The chip giant is paying a roughly 60 percent premium for McAfee to expand its presence in security services.","Intel to Buy McAfee for $7.7 Billion","Business","Intel"
"845",5,"2010-08-16T06:20:33+0000","Smooth-Stone, a semiconductor start-up, has pulled in $48 million from an international group of investors in a bid to disrupt one of Intel’s most lucrative franchises: server chips.","A Chip Start-Up Aims to Slay Intel","Business","Intel"
"846",6,"2010-08-27T03:31:03+0000","Cash, caution and skepticism make expectations of a merger and acquisition boom look overdone.","Looking Askance at Acquisitions","Business","Intel"
