"","id","created_time","snippet","headline","news_desk","company_name"
"646",6,"2009-09-08T01:53:35+0000","Steve Stricker finished birdie-birdie to win the Deutsche Bank Championship and move past Tiger Woods for the lead in the playoffs for the FedEx Cup.","Stricker Erases a Failure and Woods’s FedEx Lead","Sports","Johnson & Johnson"
"647",7,"2009-10-01T10:00:23+0000","A complicated, but elegant, mathematical model helped bring the downfall of the financial sector, two analysts write.","Seduced by a Model","Business","Johnson & Johnson"
"648",8,"2009-09-07T01:48:46+0000","Steve Stricker shot six-under 65 and was in a three-way tie for first place heading into the final round at the T.P.C. Boston.","Stricker Caps His Round With an Eagle and a Share of the Deutsche Bank Lead","Sports","Johnson & Johnson"
"649",9,"2009-09-05T01:57:52+0000","President Obama is being told, as Lyndon Johnson was told about Vietnam, that more resources will do the trick in Afghanistan. It is no truer now than it was true then.","Reliving the Past","Editorial","Johnson & Johnson"
"650",10,"2009-09-28T03:38:32+0000","Co-workers say Michael C. Finton, arrested for trying to blow up a federal building, was cheerful and polite but unwavering on religion and politics.","Suspect in Illinois Bomb Plot ‘Didn’t Like America Very Much’","National","Johnson & Johnson"
"651",1,"2009-09-26T03:21:47+0000","A former hospital surgical technician who may have infected dozens of surgical patients with hepatitis C pleaded guilty to federal drug charges.","Worker in Hepatitis Case Is Sentenced to 20 Years","National","Johnson & Johnson"
"652",2,"2009-09-24T10:00:50+0000","In terms of the economic agenda at the Group of 20 meeting in Pittsburgh, the likely deliverables look thin, an economist writes.","G-20 on Economic Regulation: Don’t Get Your Hopes Up","Business","Johnson & Johnson"
"653",3,"2009-08-31T20:57:05+0000","The Hudson Valley Shakespeare Festival’s production of “Pericles” is lively, picturesque and picaresque.","Tempest-Tossed Wanderer on the River","Culture","Johnson & Johnson"
"654",4,"2009-08-19T07:48:49+0000","“None of it feels vintage,” says Betsey Johnson, surveying the 40-odd pieces that make up the Betsey Johnson Archive Curated by Opening Ceremony. The joyous reissue of her greatest hits from the 1970s and ’80s — corset lacings! giant zippers! — ex...","Now Reviving Betsey Johnson","TStyle","Johnson & Johnson"
"655",5,"2009-09-19T11:10:17+0000","To end our cycles of boom and bust, the Fed needs to fight for stronger regulation and against the powerful financial interests that encourage policy makers to avoid real reform.","The Recession Is Over — for Now","OpEd","Johnson & Johnson"
"656",6,"2009-09-17T13:26:22+0000","Not a single chief executive officer of a major American bank attended President Obama’s talk on financial regulation on Monday. Where were they? an economist wonders.","Where Were the Bank C.E.O.s on Monday?","Business","Johnson & Johnson"
"657",7,"2009-09-17T22:19:25+0000","“A Voyage of Growth and Discovery,” a wonderfully entertaining and slyly thought-provoking installation at the SculptureCenter, targets Burning Man.","Those Are Grown-Up Laughs for a Big Baby","Weekend","Johnson & Johnson"
"658",8,"2009-08-22T20:14:01+0000","Maybe Barack Obama will win his domestic battles. Maybe the economy will bounce back. But his presidency may ultimately be defined in the rugged terrain of Afghanistan.","Could Afghanistan Become Obama’s Vietnam?","WeekInReview","Johnson & Johnson"
"659",9,"2009-09-10T12:22:18+0000","Despite all we’ve learned about the dangers of a loosely regulated financial sector, an economist writes, very little real reform is underway.","What We’ve Learned: The Beast Still Lives","Business","Johnson & Johnson"
"660",10,"2009-09-10T00:09:05+0000","Three artists will recreate Allan Kaprow’s “Yard” of 1967.","Changing Un-Art’s Tires","Arts&Leisure","Johnson & Johnson"
"661",1,"2010-12-15T22:28:10+0000","Two longtime executives, Alex Gorsky and Sheri S. McCoy, have been given expanded roles in the troubled health care company.","2 in Race to Lead Johnson & Johnson","Business","Johnson & Johnson"
"662",2,"2010-12-24T16:49:35+0000","Paul Johnson’s biographical essays on humorists include obvious selections (Dickens, Chaplin) and some curious ones.","What’s So Funny?","BookReview","Johnson & Johnson"
"663",3,"2010-12-30T16:27:23+0000","Long a feature of purely internal-combustion vehicles in Europe, start-stop technology is beginning to find an American audience.","Start-Stop Technology: Not Just for Hybrids Anymore","","Johnson & Johnson"
"664",4,"2010-12-25T01:07:11+0000","Robert Formola, who sustained a fractured skull at a Jets game in Indianapolis in January, spent last Sunday as the team’s guest in Pittsburgh.","Fan’s Unforgettable Day, in Year He’d Like to Forget","Sports","Johnson & Johnson"
"665",5,"2010-12-22T18:11:39+0000","A popular feminine hygiene product has been noticeably disappearing from store shelves, without a definite explanation.","The Case of the Missing o.b. Tampons","","Johnson & Johnson"
"666",6,"2010-12-25T18:15:20+0000","In 2010, some athletes celebrated, but for others, there was much disappointment.","A Year of Milestones and Millstones","Sports","Johnson & Johnson"
"667",7,"2010-12-18T01:00:57+0000","Andrew Johnson, the man who would later succeed Lincoln, made his name with a startling speech about secession.","The Tailor Draws a Line","OpEd","Johnson & Johnson"
"668",8,"2010-12-17T20:19:06+0000","In congressman’s letter to the F.D.A., the Best Sweet plant in Mooresville, N.C., is revealed as the maker of millions of Rolaids recalled by Johnson & Johnson.","N. C. Plant Found to Be Maker of Recalled Rolaids","Business","Johnson & Johnson"
"669",9,"2010-12-21T01:33:13+0000","The British do many things well, but handling snow does not seem to be one of them.","Ill Prepared for Snowfall, Britain Crawls to a Halt","Foreign","Johnson & Johnson"
"670",10,"2010-12-16T22:05:29+0000","DePuy’s artificial hip was marketed in the United States with a crucial component that had not been rigorously tested in patients.","The Implants Loophole","Business","Johnson & Johnson"
"671",1,"2010-12-14T03:24:03+0000","David W. Johnson was suspended on Feb. 25 after a report that he had assaulted his former companion, Sherr-una Booker, in a case that wracked Gov. David A. Paterson’s administration this year.","After Months in Limbo, Paterson Aide Charged in Abuse Case Is Fired","Metro","Johnson & Johnson"
"672",2,"2010-12-13T01:34:22+0000","Playing like anything but the cellar-dweller they are, the Nets battled the defending champion Lakers basket for basket in a 99-92 loss.","The Nets Give the Lakers All That They Can Handle","Sports","Johnson & Johnson"
"673",3,"2010-11-29T12:21:44+0000","Bills receiver Steve Johnson may be taking more criticism for how he’s handling his  dropped pass against the Steelers  than for  the drop itself.","Bills’ Steve Johnson Can’t Get Past Missed Catch","","Johnson & Johnson"
"674",4,"2010-12-13T02:35:20+0000","From a shirt naming rights deal with Barcelona, to a first-place tie in the Premier League, the region is increasing its profile in world soccer.","Middle East Becomes Bigger Player","Sports","Johnson & Johnson"
"675",5,"2010-12-10T00:04:28+0000","A Johnson & Johnson unit announced a nationwide recall of more than 13 million packages of Rolaids after reports of consumers finding metal and wood particles in the products.","J.&J. Unit Issues Recall of Rolaids","Business","Johnson & Johnson"
"676",6,"2010-12-14T03:24:40+0000","Ken Oberkfell and Mookie Wilson highlight the list of new Mets coaches.","Familiar Faces Round Out Mets’ Coaching Staff","Sports","Johnson & Johnson"
"677",7,"2010-12-08T22:12:26+0000","Plaintiffs around the country contended that they suffered tendon injuries upon taking the antibiotic.","Verdict Against J.&J. in Levaquin Case","","Johnson & Johnson"
"678",8,"2010-12-08T12:24:59+0000","Johnson & Johnson made a formal offer on Wednesday for Crucell, a Dutch biotechnology company.","J.&J. Bids $2.3 Billion for Crucell","","Johnson & Johnson"
"679",9,"2010-12-11T02:11:33+0000","Joseph Bramlett’s background matches with Tiger Woods’s in a number of ways, but he has yet to hit a shot on the PGA Tour.","Joseph Bramlett, Ex-Stanford Golfer, Draws Comparisons to Woods","Sports","Johnson & Johnson"
"680",10,"2010-12-07T21:59:39+0000","A British scholar writes his appreciation of the chuckle- and the guffaw-producing.","Laughing Matters: Discuss","Culture","Johnson & Johnson"
"681",1,"2010-11-24T00:59:27+0000","Jimmie Johnson and his team have been so dominant in Nascar that some fans and drivers claim he is responsible for a dip in attendance and TV ratings.","Johnson Is Nascar’s Dynasty of One","Sports","Johnson & Johnson"
"682",2,"2010-12-04T23:47:29+0000","Jeh C. Johnson, the Defense Department’s general counsel, had to navigate numerous legal challenges to the 17-year-old “don’t ask, don’t tell” law as he prepared the report for repeal.","For Pentagon Lawyer Who Co-Wrote Report on Gays, Military Bias Hits Home","National","Johnson & Johnson"
"683",3,"2010-11-24T05:21:24+0000","The Asian studies scholar believed that the United States was using its military to try to control the world economy.","Chalmers Johnson Dies at 79; Criticized U.S. Role in World","Foreign","Johnson & Johnson"
"684",4,"2010-12-03T01:57:49+0000","Since retiring, Curtis Martin has concentrated ambitions closer to his heart: business, philanthropy and owning an N.F.L. franchise.","Curtis Martin Used Football to Find Some Real Work","Sports","Johnson & Johnson"
"685",5,"2010-11-22T01:57:48+0000","Jimmie Johnson also gave team owner Rick Hendrick his 10th Cup championship, including four with Jeff Gordon and one with Terry Labonte. No team has won as many titles.","Johnson Overcomes Deficit to Capture His Fifth Consecutive Sprint Cup","Sports","Johnson & Johnson"
"686",6,"2010-11-29T16:30:25+0000","After beating the Eagles on Sunday, the Chicago Bears are no longer quietly competing for the N.F.C.’s top playoff seed.","Bears Are Contending Again","Sports","Johnson & Johnson"
"687",7,"2010-11-29T15:52:12+0000","Entering Monday’s game, 23 of the 32 N.F.L. teams were within two games of the lead in their division, with five games left.","Record Parity, and Playoff Hopes to Go With It","Sports","Johnson & Johnson"
"688",8,"2010-11-29T01:27:18+0000","Thirteen players who spent at least part of the dismal 2009-10 season with the Nets are no longer with the organization.","Former Nets Try to Put Losing Season Behind Them","Sports","Johnson & Johnson"
"689",9,"2010-11-26T22:47:46+0000","A new F.D.A. inspection shows that a division of Johnson & Johnson has not corrected its manufacturing problems.","Drug Maker Cited on Quality Issues","Business","Johnson & Johnson"
"690",10,"2010-11-24T02:26:34+0000","S.C. Johnson plans to disclose all of the ingredients in familiar products like Glade, Pledge and Windex by 2012.","Telling Consumers What’s Inside","Business","Johnson & Johnson"
"691",1,"2010-11-25T14:30:20+0000","With a new marketing campaign harking back to its former presidential endorsements, Vulcain is hoping to make a comeback soon in the U.S. market with its alarm wristwatch, the Vulcain Cricket.","Presidential Alarm Sounds Again","Styles","Johnson & Johnson"
"692",2,"2010-11-23T23:34:33+0000","For Dwayne Johnson, “Faster” is a total about-face after the family-friendly baby food of “The Tooth Fairy.”","From Tooth Fairy to High-Speed Human Tank","Culture","Johnson & Johnson"
"693",3,"2010-11-23T05:07:22+0000","Some flavored Benadryl allergy tablets and bottles of junior-strength Motrin were recalled at the wholesale level because of manufacturing problems.","Children’s Benadryl Tablets Recalled","Business","Johnson & Johnson"
"694",4,"2010-11-20T18:56:44+0000","With the closest finish in the Chase for the Sprint Cup since it began seven years ago, Nascar officials can only hope the excitement will lift television ratings.","Nascar Has the Finish, if Not the TV Viewers","Sports","Johnson & Johnson"
"695",5,"2010-11-22T02:46:06+0000","Santonio Holmes, who capped the victory over the Texans with a late touchdown, has been a spark in the Jets’ last four wins.","Jets Turn to Holmes, and He Comes Through Again","Sports","Johnson & Johnson"
"696",6,"2010-11-22T00:04:07+0000","After watching a 23-7 lead turn into a 24-23 deficit, the Jets closed it out on Santonio Holmes’s scoring reception.","Jets Top Texans in Closing Seconds","Sports","Johnson & Johnson"
"697",7,"2010-11-15T15:20:41+0000","The Cowboys have talent, but it’s too late for this season. Changes, and a psychological overhaul, are still needed.","Win Doesn’t End Cowboys’ Troubles","Sports","Johnson & Johnson"
"698",8,"2010-11-04T01:27:51+0000","Republicans are leading in three races; if they win them, they will have a 33-to-29 majority.","Hopeful in 3 Tight Races, G.O.P. Is on Cusp of Control of New York Senate","Metro","Johnson & Johnson"
"699",9,"2010-11-01T02:36:47+0000","It’s a close race between Senator Russ Feingold and Ron Johnson, a plastics manufacturer, in a state President Obama won by 14 points.","A Battle of Plaid Shirts and Conflicting Visions","National","Johnson & Johnson"
"700",10,"2010-10-29T18:22:07+0000","The shuttered Dance Theater of Harlem has a new artistic director, Virginia Johnson, and a plan to bring the company back to life in 2013.","Harlem Troupe Prepares for Act II","0","Johnson & Johnson"
"701",1,"2010-10-19T22:04:47+0000","The company, which increased its earnings guidance for the year, blamed the recalls of its brand-name medicines for lower third-quarter sales","Sales Decline, but Earnings Rise for Johnson & Johnson","Business","Johnson & Johnson"
"702",2,"2010-10-28T20:05:32+0000","Newark is striving to overcome imperfections, and the Nets are a star-crossed franchise with nowhere to go but up.","Revamped Nets Feel Like a Good Fit in Striving Newark","Sports","Johnson & Johnson"
"703",3,"2010-10-28T02:56:09+0000","The Nets accomplished a feat Wednesday night that took 3 coaches, 19 games and 38 days last season. They won.","Nets Win Opener Over Pistons but Admit It’s Still Early","Sports","Johnson & Johnson"
"704",4,"2010-10-28T00:17:14+0000","General Dynamics said it delivered 23 Gulfstream planes in the third quarter, up from 17 a year earlier.","Gulfstream Orders Suggest Recovery in Business Jets","Business","Johnson & Johnson"
"705",5,"2010-10-23T22:44:12+0000","Views from readers, responses from the staff and thoughts from the public editor.","Carrying the Facts Too Far","Editorial","Johnson & Johnson"
"706",6,"2010-10-23T01:47:50+0000","Russ Feingold may be the most independent senator, and he is in a supertough re-election race.","Elections: Oshkosh Shrugged","Editorial","Johnson & Johnson"
"707",7,"2010-10-16T00:44:55+0000","Only five drivers are within 150 points of Jimmie Johnson, seeking a fifth straight championship, in the Chase for the Sprint Cup.","Johnson Seems Unbeatable as Chase Nears the Midpoint","Sports","Johnson & Johnson"
"708",8,"2010-12-29T00:50:28+0000","Stranded in Connecticut, a reporter’s plight is news at home in Montana on Twitter and Facebook.","Storm on East Coast Is Local News in West","National","Johnson & Johnson"
"709",9,"2010-12-30T10:00:46+0000","As the Europeans eventually find the political will to tackle their deficits, can the United States do the same, an economist asks.","Fresh Crises Loom in Europe and the U.S.","","Johnson & Johnson"
"710",10,"2010-12-27T21:03:00+0000","Is uranium a victim of emotional prejudice or a dangerous and unwelcome energy source?","In the Job-Starved West, a Debate Over Uranium’s Legacy","","Johnson & Johnson"
"711",1,"2010-12-30T22:45:05+0000","Ken Johnson discusses some of his favorite paintings in New York museums.","Perfect Poise, Pulled From Jaws of Distortion","Weekend","Johnson & Johnson"
"712",2,"2010-12-27T21:11:14+0000","Though often thought of as a modern disease, cancer has always been with us; where scientists disagree is on how much it has been amplified by modern civilization.","Unearthing Prehistoric Tumors, and Debate","Science","Johnson & Johnson"
"713",3,"2010-12-27T01:29:59+0000","A conflict over a plan to process uranium ore in Colorado highlights the difficulty of moving away from fossil fuels.","A Battle Over Uranium Bodes Ill for U.S. Debate","National","Johnson & Johnson"
"714",4,"2010-12-23T10:00:09+0000","Limiting the compensation of banking executives is not the best way to curb their risk-taking, but it might be the option most readily available, an economist writes.","Bankers’ Pay on the Line Again","","Johnson & Johnson"
"715",5,"2010-10-22T16:36:20+0000","The Liberian president Ellen Johnson Sirleaf is trying to lift her country — ravaged by war, rape, corruption and hopelessness — by lifting up its women.","An Uncompromising Woman","Magazine","Johnson & Johnson"
"716",6,"2010-12-31T22:32:55+0000","An exhibition at the Metropolitan Museum reveals qualities of a Qing dynasty aesthetic.","To See a Universe in the Tiny Details of Chinese Artifacts, Boxes to Birds","Culture","Johnson & Johnson"
"717",7,"2010-12-23T22:39:08+0000","Some “Screen Tests” from the mid-1960s are the star attractions of the “Andy Warhol: Motion Pictures” exhibition at the Museum of Modern Art.","Warhol’s Silent Film Portraits","Weekend","Johnson & Johnson"
"718",8,"2010-12-23T21:46:42+0000","The first retrospective in the United States for Hakuin Ekaku (1685-1768), the Japanese calligrapher and draftsman, at Japan Society.","Spiritual Seeker With a Taste For the Satirical","Weekend","Johnson & Johnson"
"719",9,"2010-12-16T23:42:09+0000","Gallery shows by Gordon Onslow Ford, Daniel Hesidence, Pieter Schoolwerth, Chris Vasell, Justen Ladda and Matthew Monahan.","JUSTEN LADDA: ‘7 Mirrors and a Nose’","Weekend","Johnson & Johnson"
"720",10,"2010-12-16T10:00:40+0000","An emerging split on deficit reduction among prominent Republicans offers an opportunity for the president and his party, an economist writes.","Republican Split, Democratic Opportunity","","Johnson & Johnson"
"721",1,"2010-12-14T01:14:12+0000","A graduate student and her sister are bracing for the onslaught of cold that will keep Creede, Colo., in a long embrace.","From the Delta to Winter’s Deep Blues","National","Johnson & Johnson"
"722",2,"2010-12-11T00:59:54+0000","A federal jury in Utah convicted Brian D. Mitchell in the 2002 abduction of Ms. Smart, disregarding defense claims that Mr. Mitchell was insane.","Verdict Is Guilty in Abduction of Elizabeth Smart","National","Johnson & Johnson"
"723",3,"2010-12-09T23:20:49+0000","Exhibitions by Bruce Nauman, Matt Connors, Peter Campus, Kent Dorn and Jennifer Sullivan, and a look at Giacometti’s studio.","PETER CAMPUS: ‘Calling for Shantih’","Weekend","Johnson & Johnson"
"724",4,"2010-12-09T23:20:22+0000","Exhibitions by Bruce Nauman, Matt Connors, Peter Campus, Kent Dorn and Jennifer Sullivan, and a look at Giacometti’s studio.","Kent Dorn, ‘Remains,’ and Jennifer Sullivan, ‘One-Week Walden’","Weekend","Johnson & Johnson"
"725",5,"2010-12-09T10:00:45+0000","Any effort to stimulate the economy by adding to the deficit is perilous in the long run and must be handled carefully, an economist writes.","What’s Wrong With Cutting Taxes?","","Johnson & Johnson"
"726",6,"2010-12-09T22:43:43+0000","“Norman Rockwell: Behind the Camera,” at the Brooklyn Museum, examines Rockwell’s process of using photographs to achieve naturalism in his paintings.","His Path From Shutter to Paintbrush","Weekend","Johnson & Johnson"
"727",7,"2010-12-07T16:34:33+0000","More people are using wild lands for pursuits like illegal trophy hunting, manufacturing drugs or stashing weapons.","For Wildlife Rangers, a Human Menace","","Johnson & Johnson"
"728",8,"2010-12-07T00:37:07+0000","Rangers and wildlife officers are finding they must increasingly confront people with guns.","In the Wild, a Big Threat to Rangers: Humans","National","Johnson & Johnson"
"729",9,"2010-12-02T10:00:57+0000","The financial disarray in some European countries instigates domestic and regional political disquiet, which in turn may exacerbate problems, an economist writes.","How Likely Is Default in Europe?","","Johnson & Johnson"
"730",10,"2010-12-02T22:49:38+0000","“Charles LeDray: workworkworkworkwork” examines the artist’s meticulous miniatures at the Whitney Museum of American Art.","Getting Small: A Man’s World, in Miniature","Weekend","Johnson & Johnson"
"731",1,"2010-11-28T02:22:12+0000","For all its well-worn ruts, the Christmas season can create new traditions when you least expect them.","This Holiday Season, Traditions With a Twist","National","Johnson & Johnson"
"732",2,"2010-11-28T02:14:10+0000","Sales of artificial Christmas trees are on the rise, even in places like Fort Collins, Colo., where houses are surrounded by the real thing.","How Lovely Are Your Polyethylene Branches","National","Johnson & Johnson"
"733",3,"2010-11-28T12:40:44+0000","After the United States and South Korea began naval exercises as a warning to North Korea, China called for a meeting of six nations.","China Seeks Talks to Ease Korean Tension","Foreign","Johnson & Johnson"
"734",4,"2010-11-25T19:53:55+0000","Joan Thorne’s new, exuberantly brushy, fruit- and candy-colored canvases fit right in with the permissive pluralism of painting today.","JOAN THORNE: ‘Recent Paintings’","Weekend","Johnson & Johnson"
"735",5,"2010-11-26T01:01:53+0000","From a watchtower in Hooper, Colo., all manner of humans look for any manner of extraterrestrial life.","Pit Stop for U.F.O.’s, and Humans Who Love Them","National","Johnson & Johnson"
"736",6,"2010-11-25T23:27:16+0000","The artist wants to drape 5.9 miles of the Arkansas River in fabric, but not everyone in the area is a fan of the plan.","Another Christo Project, to Engage and Divide","National","Johnson & Johnson"
"737",7,"2010-11-25T11:00:49+0000","Reckless cross-border lending by big banks has made many nations vulnerable to Ireland’s fiscal crisis, an economist writes — and none more so than Belgium.","Will Ireland Default? Ask Belgium","","Johnson & Johnson"
"738",8,"2010-11-26T08:17:47+0000","China engaged in a flurry of diplomatic activity to calm rising tensions between the Koreas, but with a swipe at the United States.","China Addresses Rising Korean Tensions","Foreign","Johnson & Johnson"
"739",9,"2010-10-13T21:19:34+0000","Richard Johnson last week announced his departure from a column in The New York Post that he led for almost 25 years, leaving some to reflect on his influence.","In a Page Six Reign, Stars and Scars","Styles","Johnson & Johnson"
"740",10,"2010-10-13T01:02:06+0000","Unlike many other Democrats, Senator Russ Feingold is making the case that there is a substantive choice to be made on Election Day.","Uphill in Wisconsin","Editorial","Johnson & Johnson"
"741",1,"2010-11-23T13:02:05+0000","As they prepare for talks next week in Mexico, Chinese officials said they want the West to take the lead.","China Sets Tough Line in Climate Talks","Foreign","Johnson & Johnson"
"742",2,"2010-11-23T17:12:13+0000","North Korea’s unending appetite for confrontation has complicated relations with China, its supposed patron.","North Korea Relies on China, but Tends to Resist Its Guidance","Foreign","Johnson & Johnson"
"743",3,"2010-11-18T21:49:07+0000","Gallery shows of: Marlene McCarty, Charlotte Park, Adrian Piper, John Currin and Paul Lee.","JOHN CURRIN: ‘New Paintings’","Weekend","Johnson & Johnson"
"744",4,"2010-11-17T10:00:10+0000","Start fixing the budget deficit by overhauling the overly complex and out-of-date tax system, an economist writes.","Fixing the Budget, and Deciding on Inequality","","Johnson & Johnson"
"745",5,"2010-11-14T00:10:45+0000","In Larimer County, Colo., people on both sides of the political spectrum see a call to action in election results.","After Midterms, Even Opposites Can Sound Alike","National","Johnson & Johnson"
"746",6,"2010-10-08T00:31:21+0000","After 25 years of writing gossip for the New York tabloid, he takes a digital job in Los Angeles.","The Editor of Page Six Is Departing After 25 Years","Business","Johnson & Johnson"
"747",7,"2010-10-07T22:51:32+0000","Sam Taylor-Wood’s “Nowhere Boy” delves into a tumultuous period in his life, when he sought maternal love and artistic freedom.","Lennon’s Teenage Years: Rocking and Roiling","Weekend","Johnson & Johnson"
"748",8,"2010-11-12T07:39:01+0000","These new Abstract Expressionist-scale paintings project an infectious, meditative mood suitable for extended study of their balletic choreography.","Brice Marden: ‘Letters,’ and ‘Paintings 1961-1964’","Weekend","Johnson & Johnson"
"749",9,"2010-11-12T07:48:00+0000","The Austrian sculptor of funny transformations has exhibited all over the world but has made little headway in New York. This entertaining show could make the difference.","Erwin Wurm: ‘Gulp’","Weekend","Johnson & Johnson"
"750",10,"2010-11-12T22:35:30+0000","A roundup of art books selected by The Times critics Holland Cotter, Roberta Smith, Ken Johnson and Karen Rosenberg.","Art Books","Weekend","Johnson & Johnson"
"751",1,"2010-11-11T10:00:06+0000","The Group of 20 leaders would only be kidding themselves if they affirm that proposed capital standards are going to make global banking safer, an economist writes.","Capital Failure","","Johnson & Johnson"
