"","id","created_time","snippet","headline","news_desk","company_name"
"2046",6,"2014-09-11T00:52:20+0000","Microsoft’s acquisition of Minecraft would be an acknowledgment that gaming is central to many people’s lives, serving as an engaging mode of entertainment or merely a time killer.","Microsoft Sees More Than Fun in a Game Like Minecraft","Business","Microsoft"
"2047",7,"2014-09-17T11:42:53+0000","Plus, backing up an iPhone’s photos.","Defragmenting the Hard Drive on a Windows PC","Business","Microsoft"
"2048",8,"2014-09-04T23:30:07+0000","The devices are the first the company has released since the completion of the acquisition of Nokia’s cellphone business.","Microsoft Introduces Three New Smartphones","Business","Microsoft"
"2049",9,"2014-09-13T14:20:20+0000","The smartphone offerings of Apple, Amazon, Microsoft and Samsung have a lot to say about the companies’ approach to most everything.","Smartphones: The Corporate Personality Test","NODESK","Microsoft"
"2050",10,"2014-09-11T10:57:54+0000","Microsoft’s acquisition of Minecraft would be an acknowledgment that games are central to many people’s lives, as players can spend months building estates and entire countries.","Daily Report: In Popular Games Like Minecraft, Tech Titans See Potential Beyond Fun","Business","Microsoft"
"2051",1,"2014-09-10T11:00:39+0000","Apple wasn’t the only big tech outfit with something to talk about on Tuesday. Intel met with developers to discuss how it is changing from a chip-centric company to one with a variety of products and services.","Intel Shares More of Its Extreme Makeover","Business","Microsoft"
"2052",2,"2014-09-05T21:04:11+0000","At the IFA consumer electronics show in Berlin, most of the major smartphone makers introduced new devices, features or pricing in attempts to distinguish themselves within a crowded industry.","During a Season for New Devices, a Tough Market for Smartphone Makers","Business","Microsoft"
"2053",3,"2014-09-04T19:56:11+0000","Microsoft and two trade groups for German publishers said the plan to reduce Google’s dominance of the search market was inadequate.","Opposition Grows in Europe to Google Antitrust Proposal","Business","Microsoft"
"2054",4,"2014-09-03T09:47:40+0000","The U.S.-China Business Council issued a report taking aim at China’s antimonopoly law, highlighting ways it says enforcement could be improved.","Western Companies Appear to Push Back Against Chinese Crackdown","Business","Microsoft"
"2055",5,"2014-08-20T10:25:26+0000","The tech company’s former chief executive said new responsibilities, including ownership of the Los Angeles Clippers, have made him too busy to serve.","Daily Report: Steve Ballmer Resigns From Board of Microsoft","Business","Microsoft"
"2056",6,"2014-08-19T19:13:13+0000","The tech company’s former chief executive said new responsibilities, including ownership of the Los Angeles Clippers, have made him too busy to serve.","Steve Ballmer Quits Microsoft Board, Citing His Outside Duties","Business","Microsoft"
"2057",7,"2014-08-25T20:43:22+0000","Plus, how to see which devices are connected to your Mac.","Ways to Protect a PC With Windows 8.1","Business","Microsoft"
"2058",8,"2014-08-04T14:48:28+0000","A government agency investigating complaints against the company issued a statement “officially warning” the firm to obey Chinese law.","China Tells Microsoft Not to Interfere With Inquiry","Business","Microsoft"
"2059",9,"2014-08-01T23:00:55+0000","The lawsuit claimed that Samsung failed to follow the terms of a 2011 patent licensing deal between the two companies.","Microsoft Sues Samsung Over Android Royalty Payments","Business","Microsoft"
"2060",10,"2014-07-30T03:27:59+0000","An announcement by the state antimonopoly agency confirmed that Microsoft was under scrutiny, and said that officials had conducted surprise visits to company offices across China.","China Investigating Microsoft for ‘Monopolistic Behavior’","Business","Microsoft"
"2061",1,"2014-08-18T13:00:56+0000","A team of computer scientists at Columbia has developed a research tool for tracking the use of personal data online.","XRay: A New Tool for Tracking the Use of Personal Data on the Web","Business","Microsoft"
"2062",2,"2014-08-03T13:00:21+0000","Titans from earlier heydays of computing have both seen recent increases that outstripped the cloud-computing industry generally, according to industry reports.","Cloud Revenue Jumps, Led by Microsoft and IBM","Business","Microsoft"
"2063",3,"2014-08-16T00:09:30+0000","Plus, how to consolidate online address books. ","Quicker Ways to Digitize Old Photographs","Business","Microsoft"
"2064",4,"2014-07-21T01:20:17+0000","Bradford L. Smith, general counsel at the tech company, uses the skills he learned as a Washington lawyer to advocate change in government policies that affect the industry.","Microsoft’s Top Lawyer Is the Tech World’s Envoy","Business","Microsoft"
"2065",5,"2014-07-31T19:50:58+0000","Other big technology companies are watching the case, which Microsoft said it would appeal, as a potential threat to their plans to offer cloud computing overseas.","Judge Rules That Microsoft Must Turn Over Data Stored in Ireland","Business","Microsoft"
"2066",6,"2014-08-13T10:31:00+0000","Personal data on millions of people can now be analyzed by researchers without the subjects’ knowledge, posing an ethical problem.","Daily Report: As Social Media Studies Proliferate, Experts Weigh Ethics Guidelines","Business","Microsoft"
"2067",7,"2014-08-13T00:22:33+0000","Scientists can now analyze the personal data on millions of people without their knowledge, and some want to bring ethical guidelines to such studies.","As Data Overflows Online, Researchers Grapple With Ethics","Business","Microsoft"
"2068",8,"2014-07-22T21:14:53+0000","Revenue at Microsoft was slightly higher than analysts expected, but earnings were 5 cents a share lower.","Microsoft’s Profits Slide on Mobile, but Its Cloud Flourishes","Business","Microsoft"
"2069",9,"2014-08-10T22:05:53+0000","The increasing application of antimonopoly laws, against companies like Microsoft and Qualcomm, has raised concern in boardrooms around the world.","China’s Energetic Enforcement of Antitrust Rules Alarms Foreign Firms","Business","Microsoft"
"2070",10,"2014-08-11T06:55:01+0000","As the Chinese government conducts more raids and investigations into foreign companies focusing on allegations of monopolistic behavior, many people are wondering: Is it true?","Q. and A.: David Hoffman on Antimonopoly Investigations into Foreign Companies in China","Foreign","Microsoft"
"2071",1,"2014-08-11T06:55:01+0000","As the Chinese government conducts more raids and investigations into foreign companies focusing on allegations of monopolistic behavior, many people are wondering: Is it true?","Q. and A.: David Hoffman on Antimonopoly Investigations into Foreign Companies in China","Foreign","Microsoft"
"2072",2,"2014-07-28T14:17:55+0000","An agency that enforces antimonopoly laws visited company offices in four cities, as the country more closely scrutinizes multinational companies.","With Microsoft in Sights, China Starts to Squeeze U.S. Tech Companies","Business","Microsoft"
"2073",3,"2014-07-17T12:29:58+0000","The company said about 14 percent of its work force would be eliminated, largely in the mobile phone business it acquired from Nokia.","Microsoft to Lay Off Thousands, Most From Nokia Unit","Business","Microsoft"
"2074",4,"2014-07-24T09:41:56+0000","When adjusted for that sale and other divestments, however, the Finnish company reported a net loss of 26 million euros in the second quarter.","Sale of Handset Unit Bolsters Nokia’s Profit","Business","Microsoft"
"2075",5,"2014-07-17T12:46:06+0000","Microsoft announced on Thursday that it would eliminate up to 18,000 jobs over the next year as part of a major restructuring.","Daily Report: Microsoft Says It Will Cut Up to 18,000 Jobs","Business","Microsoft"
"2076",6,"2014-07-10T17:35:55+0000","An essay sent to Microsoft employees by the company’s chief executive appears to lay the groundwork for significant changes that will be revealed later this month.","Satya Nadella Says Changes Are Coming to Microsoft","Business","Microsoft"
"2077",7,"2014-07-17T19:03:06+0000","Microsoft said that roughly 1,100 layoffs, or 6 percent of the total job cuts, would come from Finland, primarily from a manufacturing plant in the north of the country.","Finnish Pride Takes Another Blow From Microsoft Job Cuts","Business","Microsoft"
"2078",8,"2014-07-09T15:06:25+0000","The company plans to follow the lead of Google, which responded to a European court’s online privacy ruling in May by creating a form to request removal of links to material that individuals say violates their online privacy.","Microsoft Taking Steps to Comply With the Right to be Forgotten","Business","Microsoft"
"2079",9,"2014-07-31T11:01:30+0000","Nobody quite knows why, but Beijing has launched apparent antitrust investigations against Microsoft and others.","China Harasses U.S. Tech Companies","Editorial","Microsoft"
"2080",10,"2014-07-29T22:21:42+0000","The Pacific Northwest city continues its rise as the world’s center of cloud computing, moving from infrastructure to applications. Oracle is kicking off a 100-person engineering facility, which over time is expected to affect sales, training, and...","Seattle Takes Oracle’s Cloud","Business","Microsoft"
"2081",1,"2014-07-28T00:08:37+0000","Congress needs to clarify how and when the government can obtain private messages and documents stored abroad.","Adapting Old Laws to New Technologies","Editorial","Microsoft"
"2082",2,"2014-07-25T21:03:30+0000","Amazon Web Services reported a surprising decline in quarterly revenue on Thursday. Amazon blamed Google’s price cuts, but its web services could be hitting some harder business sales.","Challenges for Amazon’s Cloud Computing Hopes","Business","Microsoft"
"2083",3,"2014-06-25T18:34:29+0000","Tech companies are poised to compete in selling services to businesses and gathering information on who does what within them.","Google, Microsoft and Others Delve Deeper Into Cloud Storage for Businesses","Business","Microsoft"
"2084",4,"2014-06-16T16:00:31+0000","Microsoft plans to make predictive data analysis, now an arcane field, a standard part of business. The company says that a product due out in July will simplify what are now expensive, difficult processes.","Microsoft Unveils Machine Learning for the Masses","Business","Microsoft"
"2085",5,"2014-06-23T22:17:36+0000","A Microsoft-funded venture is aimed at designing computers that can solve problems in fields as diverse as chemistry, material science, artificial intelligence and code-breaking.","Microsoft Makes Bet Quantum Computing Is Next Breakthrough","Business","Microsoft"
"2086",6,"2014-07-25T16:26:55+0000","Plus, how to multitask with Windows 8.1.","A Mac That Keeps Working, Even in Sleep Mode","Business","Microsoft"
"2087",7,"2014-06-17T15:51:06+0000","Users who mainly want a tablet that can sometimes be used a computer may be fine, but if you want to do intensive work, the Surface Pro isn’t the best.","Microsoft’s Surface Pro 3 Isn’t for Everybody","Business","Microsoft"
"2088",8,"2014-06-24T11:22:06+0000","The company’s new venture is aimed at designing fast computers that can solve a variety of problems by exploiting the weird physical properties of subatomic particles.","Daily Report: Microsoft Sees Quantum Computing as Technology’s Next Frontier","Business","Microsoft"
"2089",9,"2014-06-11T00:46:52+0000","The objection to hand over email stored in an Irish data center is believed to be the first time a corporation has challenged a domestic search warrant seeking digital information overseas.","Microsoft Protests Order to Disclose Email Stored Abroad","Business","Microsoft"
"2090",10,"2014-06-11T04:09:23+0000","The games business is increasingly experimenting with how to get its customers to pay for a game, and then to pay again later for what is essentially the same title with some additional perks","The Old Is New Again at E3 for Sony and Microsoft","Business","Microsoft"
"2091",1,"2014-12-24T10:44:46+0000","In a legal brief supporting the tech giant’s appeal of a search warrant for communications stored at a Dublin data center, the Irish government said that courts in the United States should respect the sovereignty of other countries.","Ireland Lends Support to Microsoft in Email Privacy Case","Business","Microsoft"
"2092",2,"2014-12-26T21:11:42+0000","Over the Christmas holiday, the gaming servers for Microsoft’s Xbox and Sony’s PlayStation 4 were offline, rendering the devices partly unusable.","Sony PlayStation and Microsoft Xbox Live Networks Attacked by Hackers","Business","Microsoft"
"2093",3,"2014-12-15T20:42:37+0000","A broad array of organizations in technology, media and other fields — including Apple, Amazon, National Public Radio and Fox News — rallied behind Microsoft’s effort to block American authorities from seizing a customer’s emails stored in Ireland...","Tech and Media Companies Back Microsoft in Privacy Case","Business","Microsoft"
"2094",4,"2014-12-24T17:40:57+0000","In getting behind “The Interview,” Google and Microsoft joined what had become more a campaign to defend free speech against foreign intimidation than a business initiative.","Sony Streams ‘The Interview’ on YouTube, Google Play and Xbox","Business","Microsoft"
"2095",5,"2014-12-12T00:49:30+0000","The new system is meant to streamline the complex web of menus and replace it with a more intuitive one akin to a smartphone.","Ford Trades Microsoft for BlackBerry in Revamping In-Car System ","Business","Microsoft"
"2096",6,"2014-12-04T17:08:24+0000","Two years after Microsoft invested $300 million in the Barnes & Noble e-reading business, the value of the Nook has declined by more than half.","How the Promise of Microsoft’s Investment in Nook Soured","Business","Microsoft"
"2097",7,"2014-12-04T15:06:21+0000","The announcement came as the chain announced a 2.7 percent drop in revenue overall, but a 41 percent skid in its Nook division sales.","Barnes & Noble and Microsoft End Nook Partnership","Business","Microsoft"
"2098",8,"2014-12-01T20:40:59+0000","Microsoft said it acquired Acompli, a young start-up that makes an email application for iOS and Android mobile devices, for about $200 million.","Microsoft Buys Acompli, an Email Start-Up","Business","Microsoft"
"2099",9,"2014-12-31T20:07:00+0000","Sony’s new partners will expand digital availability of the film, which will also have a wider theatrical release starting Friday.","Sony’s ‘The Interview’ Is Set for On-Demand and Wider Online Viewing","Business","Microsoft"
"2100",10,"2014-12-24T20:40:38+0000","Also, how to force-quit apps on Windows 8.1.","Trying to Update an Overloaded iPhone","Business","Microsoft"
"2101",1,"2014-12-17T02:36:13+0000","Critics of Google are turning to state attorneys general to push the company to censor illegal content and sites from search results.","Google’s Detractors Take Their Fight to the States","Business","Microsoft"
"2102",2,"2014-12-17T17:28:34+0000","Apps offer Christmas-themed diversions and recipes, as well as ways to organize your gift plans.","Santa Apps Bring Fun and Order to the Holiday Season","Business","Microsoft"
"2103",3,"2014-12-10T22:45:21+0000","Also, scanning a Mac for malware.","Keeping Up With Windows Update","Business","Microsoft"
"2104",4,"2014-12-08T20:58:51+0000","European privacy regulators gathered to discuss the growing public outcry over how governments and tech giants gather and use people’s data.","European Privacy Debate on Display in Paris","Business","Microsoft"
"2105",5,"2014-12-02T18:20:03+0000","Most Windows and Mac editions of Microsoft Word have a setting that automatically backs up documents. Also, how to export your Gmail contacts.","How to Restore Old Versions of Word Documents","Business","Microsoft"
"2106",6,"2014-11-17T23:03:54+0000","What do you do when you are a billionaire and a movie buff? If you are Paul G. Allen, you turn the iconic theater you already own into a state-of-the-art theater.","Microsoft Billionaire Reboots Seattle Movie Temple","Business","Microsoft"
"2107",7,"2014-11-25T12:27:56+0000","Plus, minimizing the translucent look of windows and menus in OS X Yosemite.","AirDrop Alternatives for Windows and Android","Business","Microsoft"
"2108",8,"2014-11-23T12:00:06+0000","The next big technology migration will change how workplaces are organized. Bad news, middle managers: You’re going to get less important.","What Cloud Computing Means to Your Job","Business","Microsoft"
"2109",9,"2014-11-10T13:30:17+0000","Satya Nadella, the company’s chief executive, discusses how Microsoft’s focus on helping people “get stuff done” distinguishes it from competitors like Google and Apple.","Microsoft’s Nadella Talks About the Future of Office","Business","Microsoft"
"2110",10,"2014-11-10T18:42:22+0000","A campaign that rivals the promotion of a major movie is underway for Halo: The Master Chief Collection, a set of four Xbox video games.","Microsoft Hopes This Video Game Collection Wings Its Way to Success","Business","Microsoft"
"2111",1,"2014-11-18T11:42:14+0000","The N1, with a 7.9 inch display and run on Google’s Android operating system, will pit the Finnish company against its longtime ally Microsoft.","With New Tablet, Nokia Returns to Devices","Business","Microsoft"
"2112",2,"2014-11-06T14:00:36+0000","In a sign of the seismic changes underway in the tech industry, Microsoft will give away the software for iPads, iPhones and Android tablets.","Microsoft, Changing Tack, Makes Office Suite Free on Mobile","Business","Microsoft"
"2113",3,"2014-11-06T14:08:50+0000","The free software for iPads, iPhones and Android tablets will do most of the most essential tasks done with the computer versions of the product, whose applications include Word, Excel and PowerPoint.","Daily Report: Microsoft Offering Free Mobile Version of Office","Business","Microsoft"
"2114",4,"2014-11-02T20:59:41+0000","The company’s new wearable device may be the most flexible of its kind available now.","Microsoft Band Is a Welcome Surprise in the Wearable Market","Business","Microsoft"
"2115",5,"2014-11-10T21:38:46+0000","Plus, comparing HDTV with ultrahigh-definition.","Assessing Space on a Computer’s Hard Drive","Business","Microsoft"
"2116",6,"2014-10-30T11:07:57+0000","Microsoft is joining other companies who see wearables as a way into the wellness business without all the red tape that comes from being a true medical company.","Daily Report: Microsoft Leaps Into Wearable Fitness","Business","Microsoft"
"2117",7,"2014-11-09T12:00:25+0000","Though Ireland has been under international pressure to close loopholes that have drawn companies like Google and Microsoft, the country is still touting its low-tax appeal.","Ireland Vies to Remain Silicon Valley’s Low-Tax Home Away From Home","Business","Microsoft"
"2118",8,"2014-10-30T02:15:12+0000","Microsoft is joining the companies who see wearables as a way into the wellness business without all the red tape that comes from being a true medical company.","Microsoft Jumps Into the Growing Market for Wearable Fitness Technology","Business","Microsoft"
"2119",9,"2014-11-05T18:41:00+0000","The browser’s settings can be changed, or users can click on the address field. Also, a considering the value of a touch-screen PC.","How to See a Full Web Address on the Safari Browser","Business","Microsoft"
"2120",10,"2014-10-23T20:55:05+0000","The software company’s acquisition of Nokia helped it beat estimates, but integration costs reduced profit.","Microsoft Offers Tantalizing Signs of Progress","Business","Microsoft"
"2121",1,"2014-10-31T21:09:05+0000","Plus, donating a Windows XP computer.","Turning the PC Into a DVR","Business","Microsoft"
"2122",2,"2014-10-30T22:38:16+0000","Netbook computers, virtually a novelty alternative to notebook PCs only a year ago, are the rising stars of the computer industry.","Sleek, Chic and Agile, the Netbook Comes of Age","Technology","Microsoft"
"2123",3,"2014-10-21T04:51:22+0000","Despite being a laggard in cloud computing, Microsoft has established real credibility, and now runs twice as many data centers as Amazon and six times as many as Google.","For Microsoft, Cloud Business Looks More Promising Than Mobile","Business","Microsoft"
"2124",4,"2014-10-29T17:15:29+0000","John Markoff, who was there when the Google executive Alan Eustace set the world record for a balloon jump, tells the story behind the story.","Google Executive Sets Record for Free Fall: Reporter’s Notebook","","Microsoft"
"2125",5,"2014-10-29T02:12:49+0000","Rob McKenna and his chief deputy, Brian Moran, were almost immediately back in touch with their old office on behalf of such major clients as T-Mobile and Microsoft.","Former Washington State Attorney General Appeals to His Former Office","U.S.","Microsoft"
"2126",6,"2014-10-15T19:13:00+0000","Surface tablet computers, custom-made for in-game use, demonstrate the evolving relationships between leagues and sponsors.","Microsoft Wins a Spot on the N.F.L. Sideline","Sports","Microsoft"
"2127",7,"2014-10-22T07:00:19+0000","Cloud computing, particularly in the big rental businesses of Microsoft and Amazon, has been criticized as undependable and tough to manage. A number of recent announcements suggest that some companies are trying to address the issue.","Coming of Age in Cloud Computing","Business","Microsoft"
"2128",8,"2014-10-14T11:43:34+0000","Russian hackers used a bug in Microsoft Windows to spy on several Western governments, NATO and the Ukrainian government, according to a computer security firm.","Daily Report: Russian Hackers Exploit Flaw in Microsoft Windows to Spy on Governments","Business","Microsoft"
"2129",9,"2014-10-21T17:11:04+0000","And tips on removing malicious software from browsers.","Exporting Video From iPhoto","Business","Microsoft"
"2130",10,"2014-10-14T09:30:03+0000","The targets were often linked to the standoff in Ukraine, said iSight Partners, the computer security firm that released the report.","Russian Hackers Used Bug in Microsoft Windows for Spying, Report Says","Business","Microsoft"
"2131",1,"2014-10-19T22:40:08+0000","Apple, IBM, Microsoft and Yahoo will report quarterly results, and the results of the eurozone banks’ tests are approaching.","Tech Giants’ Earnings and Eurozone Bank Stress Tests","Business","Microsoft"
"2132",2,"2014-10-10T14:46:40+0000","One reason women are paid less than men is that they are less likely to negotiate for raises or promotions.","Why Microsoft’s Nadella Is Wrong About Women and Raises","Upshot","Microsoft"
"2133",3,"2014-10-09T22:48:35+0000","Satya Nadella, the chief executive of Microsoft, implied during a speech on Thursday that women should not ask for pay raises, a statement that quickly put him in the hot seat.","Microsoft’s Nadella Sets Off a Furor on Women’s Pay","Business","Microsoft"
"2134",4,"2014-10-15T23:35:14+0000","The way for Tim Cook, the Apple chief, to woo the fashion industry is to take its priorities seriously.","This Emperor Needs New Clothes","Styles","Microsoft"
"2135",5,"2014-10-15T17:58:34+0000","On Tuesday, researchers disclosed details of a security bug that could make web browsing sessions on a public network vulnerable to hackers.","Poodle Bug Marks Third Major Security Flaw Discovered This Year","Business","Microsoft"
"2136",6,"2014-10-14T22:29:15+0000","Plus, how to make the move from the iPhoto app in iOS 8.","Hiding History in Firefox","Business","Microsoft"
"2137",7,"2014-10-07T04:00:20+0000","The participating companies are publicly committing themselves not to sell information on kindergartners through 12th graders.","Microsoft and Other Firms Pledge to Protect Student Data","Business","Microsoft"
"2138",8,"2014-10-12T23:30:14+0000","Salesforce kicked off its annual conference with a product aimed at developers who want to build visualization tools for sales and marketing people. That’s probably a big and underserved market.","Salesforce Makes Its Big Data Move","Business","Microsoft"
"2139",9,"2014-09-30T22:16:42+0000","Microsoft believes the next version of its operating system is such a big change that it is calling the software Windows 10, skipping the more logical product name, Windows 9.","Microsoft Windows 10 Displays a Familiar Look","Business","Microsoft"
"2140",10,"2014-10-11T00:48:58+0000","Even as many barriers have fallen for working women, they continue to be treated differently on the job, particularly when negotiating a raise.","Satya Nadella’s Advice on Raises Stirs Wider Discussion Among Women","Business","Microsoft"
"2141",1,"2014-10-10T19:47:27+0000","A restaurant learns what happens when you tell customers to pay what God wants them to pay, Microsoft’s chief executive says it’s O.K. for women to ask for a raise, and new restaurants are making Detroit a “culinary oasis.”","Today in Small Business: the Rookie Cookie","Business","Microsoft"
"2142",2,"2014-09-29T17:58:53+0000","Microsoft gets into the polling business.","The Latest Player in the Polling Game? It’s Microsoft","","Microsoft"
"2143",3,"2014-09-29T11:00:13+0000","The company, having done polls through video games in 2012, plans to have its automated digital assistant survey people through their mobile phones.","Microsoft Begins a Push Into the Polling World","Business","Microsoft"
"2144",4,"2014-10-09T01:43:25+0000","Analysts say that the PC business is shrinking less slowly than in the last couple of years. It may even be poised for a period of moderate growth, at least for the large companies. Smaller ones may be in trouble.","Decline in PC Sales Starts to Slow; Largest Makers See Growth","Business","Microsoft"
