"","id","created_time","snippet","headline","news_desk","company_name"
"1369",9,"2012-10-26T20:39:08+0000","China’s cooling economy is squeezing American exporters, Apple introduced the iPad Mini, and Microsoft unveiled Windows 8 as well as its new tablet, the Surface.","Pictures From the Week in Business","Business Day","Microsoft"
"1370",10,"2012-10-16T14:40:50+0000","As the days tick down to Microsoft’s introduction of its Surface tablet, the company is revealing how it plans to price the product — more like Apple than Amazon. Instead of adopting Amazon’s cut-rate pricing on the Kindle Fire, Microsoft said it ...","Microsoft Surface to Start at $500","","Microsoft"
"1371",1,"2012-10-25T17:30:49+0000","Here is what other tech product reviewers thought of the Microsoft Surface.","Review of Reviews: The Surface","","Microsoft"
"1372",2,"2012-10-15T04:01:46+0000","After past disappointments, Microsoft has paired its latest digital music offering with the Xbox and Windows as part of a broad set of bets to regain ground it has lost to Apple and other competitors.","Microsoft Makes New Push Into Music","Business","Microsoft"
"1373",3,"2012-10-25T14:45:07+0000","In a rare joint interview on Wednesday, Steve Ballmer and Michael Dell, the chief executives of Microsoft and Dell, discussed Windows 8, how Microsoft’s new Surface tablet will compete with products from Microsoft’s partners, and the challenge of ...","Ballmer and Dell Talk Windows 8 and Surface Tablet in Joint Interview","","Microsoft"
"1374",4,"2012-10-25T00:15:42+0000","Microsoft’s Windows 8 has two different worlds, one designed primarily for touch screens, the other for mouse and keyboard.","Windows, Revamped and Split in 2","Business","Microsoft"
"1375",5,"2012-10-25T19:08:43+0000","If you install Windows 8, you’ll have to learn both environments, like it or not; you can’t live in just one environment or the other. So how are you supposed to operate it if you have a nontouch computer? David Pogue provides a cheat sheet.","A Windows 8 Cheat Sheet","","Microsoft"
"1376",6,"2012-10-24T18:22:14+0000","Apple reveals the iPad Mini. David Pogue reviews the Microsoft Surface in 60 seconds. The Mr. GIF artist collective.","TimesCast Media + Tech: Apple’s Smaller Tablets","","Microsoft"
"1377",7,"2012-10-24T18:11:37+0000","TimesCast Media+Tech: Apple reveals the iPad Mini. | David Pogue reviews the Microsoft Surface in 60 seconds. | The Mr. GIF artist collective.","Apple Takes On Smaller Tablets","ContinuousNews","Microsoft"
"1378",8,"2012-10-24T21:47:53+0000","Google and Bing offer shortcuts like calculators, flight finders and dictionaries right in the search box.","In Web Search, Be Efficient in the Terms You Use","Business","Microsoft"
"1379",9,"2012-10-24T12:56:46+0000","Google has a new Chromebook and ad campaign to go with it as it competes with Apple’s Air laptops, the iPad Mini and the Microsoft Surface.","Google Shifts Pitch for Its New Chromebooks","","Microsoft"
"1380",10,"2012-10-24T01:22:55+0000","David Pogue reviews Microsoft’s Surface, which goes on sale on Oct. 26.","60 Seconds With Pogue: Surface Tablet","Business","Microsoft"
"1381",1,"2012-10-24T01:01:27+0000","In its Surface tablet, Microsoft wanted to build a device just as good at creating work as it is at organizing it. The hardware is brilliant, but the software is another story.","Sleek Tablet, but Clumsy Software","Business","Microsoft"
"1382",2,"2012-10-23T11:31:18+0000","SkyDrive, Microsoft’s online file storage service, offers several ways to share files with other people.","Q&A: Sharing Files in the Sky","","Microsoft"
"1383",3,"2012-10-23T11:53:51+0000","The ground is shifting beneath technology titans like Intel, Google and Microsoft because of a major force: the rise of mobile devices, Claire Cain Miller and Somini Sengupta report in The New York Times.","Daily Report: Tech Giants Scramble to Meet the Challenges of a Mobile World","","Microsoft"
"1384",4,"2012-10-23T01:36:13+0000","Companies like Google, Microsoft and Intel are scrambling to reinvent their businesses now that the old model — a customer sitting at a PC — no longer applies.","In Mobile World, Tech Giants Scramble to Get Up to Speed","Business","Microsoft"
"1385",5,"2012-10-22T14:59:45+0000","Business Day Live: A foreign policy debate through an economic lens. | Microsoft hopes Windows 8 will bolster the PC market. | The Weather Channel seeks reinvention as a multimedia enterprise.","A Final Push","Business","Microsoft"
"1386",6,"2012-10-22T13:19:42+0000","Microsoft Windows, which has more than a billion users, is getting a radical makeover, a rare move for a product with such vast reach, Nick Wingfield reports in The New York Times. The new design is likely to cause some head-scratching when Window...","Daily Report: Windows Makeover May Cause Head-Scratching","","Microsoft"
"1387",7,"2012-10-22T18:26:35+0000","Twitter blocks content in Europe. Getting to know Windows 8. Deb Roy and the future of social TV analytics.","TimesCast Media + Tech: Twitter’s Content Ban","","Microsoft"
"1388",8,"2012-10-22T18:18:18+0000","TimesCast Media + Tech: Twitter blocks content in Europe. | Getting to know Windows 8. | Deb Roy and the future of social TV analytics.","Twitter’s Content Ban","ContinuousNews","Microsoft"
"1389",9,"2012-10-21T20:07:59+0000","A radical new design of Microsoft’s flagship operating system is likely to cause some head-scratching when Windows 8 goes on sale this Friday.","Fresh Windows, but Where’s the Start Button?","Business","Microsoft"
"1390",10,"2012-10-21T23:39:45+0000","The New York Times invited five computer users to try their hands at navigating Microsoft’s new tablet-friendly redesign.","Getting to Know Windows 8","Business","Microsoft"
"1391",1,"2012-10-09T22:49:09+0000","A slide in the sales of Microsoft’s flagship Windows product and a tangle with European regulators helped trim the bonuses for Steve Ballmer, Microsoft’s chief executive, and Steven Sinofsky, president of the company’s Windows division, according ...","Missteps Curb Microsoft Bonuses for Ballmer and Sinofsky","","Microsoft"
"1392",2,"2012-10-16T11:27:02+0000","Free apps, converted files or online storage folders let you read Microsoft Word files on an iPad.","Q&A: Converting Word Files Into an E-Book","","Microsoft"
"1393",3,"2012-10-16T10:00:31+0000","Intentional Software, founded by Charles Simonyi, who led the development of Microsoft’s Office programs, and David Allen, the author of “Getting Things Done,” have formed a partnership to try to design a supertool for personal productivity that w...","Seeking a Magic Tool for Personal Productivity","","Microsoft"
"1394",4,"2012-10-15T18:56:11+0000","TimesCast Media + Tech: The debates’ influence on the broadcasters. | Cory Doctorow, digital activist and novelist. | Social media meets spoken word poetry.","Debates and the Power of Live Event TV","Business","Microsoft"
"1395",5,"2012-10-13T20:57:34+0000","Advertisers are girding for battle against browser mechanisms intended to offer more online privacy. At stake is nothing less than the future of the surveillance economy.","Do Not Track? Advertisers Say ‘Don’t Tread on Us’","SundayBusiness","Microsoft"
"1396",6,"2012-10-01T19:18:33+0000","To the checklist of signs that the technology industry has entered a “post-PC” era, add this: Google’s stock market value passed that of Microsoft’s for the first time on Monday.","Google Leapfrogs Microsoft in Market Value","","Microsoft"
"1397",7,"2012-10-10T05:20:33+0000","If you dislike the default font used in new Microsoft Word documents, you can change it.","Q&A: Changing to a Favorite Font","","Microsoft"
"1398",8,"2012-10-09T12:17:50+0000","If you need a no-frills computer for just Web browsing and e-mail, there are several options.","Q&A: Finding a Simple Computer","","Microsoft"
"1399",9,"2012-10-05T16:52:55+0000","The company’s bundling of its mapping technology with the iPhone 5 brings to mind the Microsoft-Netscape antitrust battles of the 1990s.","The Shadow of Steve Jobs in Apple’s Maps Push","Business","Microsoft"
"1400",10,"2012-10-03T22:10:15+0000","The Federal Trade Commission announced a multinational push against schemes that deceive owners into allowing access to their PCs.","Multinational Crackdown on Computer Con Artists","Business","Microsoft"
"1401",1,"2012-10-04T11:36:17+0000","The “Undo” command — popular in word-processing programs — also works to reverse accidental file moves on the computer’s desktop.","Tip of the Week: Undoing an Accidental Move","","Microsoft"
"1402",2,"2012-10-03T12:00:08+0000","Video-game retail sales are faltering. Will Nintendo’s coming Wii U prove the industry’s salvation?","Gaming Faces Its Archenemy: Financial Reality","Arts&Leisure","Microsoft"
"1403",3,"2012-10-02T11:24:12+0000","You can still run old Windows XP programs on a new Windows 7 PC with tools from Microsoft.","Q&A: Running Windows XP, Virtually","","Microsoft"
"1404",4,"2012-09-30T23:26:56+0000","Microsoft is taking an unusual approach to tackling a shortage of computer science graduates — one of the most serious issues facing the technology industry, and a broader challenge for the nation’s economy.","Fostering Tech Talent in Schools","Business","Microsoft"
"1405",5,"2012-09-30T12:27:27+0000","Jan Muehlfeit, the chairman of Microsoft Europe, says Europe needs better I.T. education, and its young people need to learn to adapt to technological advancements.","Teaching Technology as It Changes","Foreign","Microsoft"
"1406",6,"2012-09-17T22:53:56+0000","The software giant has gone to court to stop what it calls a hub for illicit Internet activity owned by a Chinese businessman.","Microsoft Battles the Botnets","Business","Microsoft"
"1407",7,"2012-09-18T17:04:41+0000","Microsoft has hired Nancy Tellem, a former top CBS television executive, to oversee the production of original video content to be delivered to the company’s Xbox video game console, according to people with knowledge of the move who did not want ...","With Hollywood Hire, Microsoft Bolsters Entertainment Efforts","","Microsoft"
"1408",8,"2012-09-27T12:02:57+0000","Think your Web mail service might be down? Here’s how to check on it.","Tip of the Week: Checking the Mail Service","","Microsoft"
"1409",9,"2012-09-26T13:00:33+0000","Two new titles for the Xbox 360 Kinect video game system allow users to enter a scene from Sesame Street or Nat Geo TV.","Your Chance to Appear on ‘Sesame Street’","","Microsoft"
"1410",10,"2012-09-25T16:39:35+0000","Customers will be able to stream and download movies and television shows for a fee, and store the content in a Nook cloud.","Barnes & Noble to Introduce New Video Service for Nook Devices","","Microsoft"
"1411",1,"2012-09-14T11:49:54+0000","If you find Microsoft Word’s time-saving text formats are slowing you down, you can turn off the feature.","Q&A: Undoing AutoFormats in Microsoft Word","","Microsoft"
"1412",2,"2012-09-24T03:07:01+0000","When Internet factories come to town, they can feel less like their sleek, clean and convenient image and more like old-time manufacturing.","Data Barns in a Farm Town, Gobbling Power and Flexing Muscle","National","Microsoft"
"1413",3,"2012-09-13T23:43:40+0000","Microsoft said it had discovered several new computers, fresh from Chinese factory floors, that carried a particularly pernicious computer virus — one capable of invading bank accounts, starting computer attacks and creating back doors to let crim...","Microsoft Finds PCs That Ship Pre-Infected","","Microsoft"
"1414",4,"2012-09-24T02:10:51+0000","Quincy, a small farming town in central Washington, has become home to several enormous data centers, drawn by the cheap hydroelectric power produced along the Columbia River.","A Small Farming Community Sprouts Enormous Data Centers","U.S.","Microsoft"
"1415",5,"2012-09-19T15:30:28+0000","As the first manufacturer to support Google’s Android software, HTC, the Taiwanese handset maker, was briefly the top American smartphone maker before it was surpassed by Apple and Samsung. Now HTC is pushing another underdog: Microsoft’s Windows ...","HTC, Once Atop Market, Gambles on Windows Phone","","Microsoft"
"1416",6,"2012-09-19T18:03:45+0000","Folders in Windows 7 can be customized in a variety of ways.","Q&A: Customize Folders in Windows 7","","Microsoft"
"1417",7,"2012-09-04T15:00:57+0000","Windows Server 2012 is designed both to work independently and to connect with some 200 online services that Microsoft offers through its Azure cloud computing system.","Microsoft Moves Further Into the Cloud","","Microsoft"
"1418",8,"2012-09-05T14:38:09+0000","Nokia and Microsoft, two companies that have not gotten much traction in the smartphone market, are hoping for another chance. The companies on Wednesday unveiled Lumia smartphones that include the Windows Phone operating system — new models of pr...","Microsoft and Nokia Unveil New Lumia Phones","","Microsoft"
"1419",9,"2012-09-15T20:08:40+0000","Some Web browsers have been offering “do not track” options for users who prefer not to have their activity tracked for marketing. Microsoft is taking the idea even further.","When the Privacy Button Is Already Pressed","SundayBusiness","Microsoft"
"1420",10,"2012-09-11T11:17:52+0000","Microsoft gives desktop Gadgets in Windows Vista and Windows 7 an early retirement due to security concerns.","Q&A: The End of Windows Gadgets","","Microsoft"
"1421",1,"2012-09-10T14:45:35+0000","There was a time when spotting an Apple product in the average corporate workplace was only slightly easier than catching a glimpse of a unicorn. Now comes a report saying that Apple will likely be the main reason the corporate computer hardware m...","Apple as the Last Hope for Growth in Business PCs","","Microsoft"
"1422",2,"2012-09-05T15:17:50+0000","Setting up a wireless printer on a home network usually takes a little time, software configuration and a network password.","Q&A: Setting Up A Wireless Printer","","Microsoft"
"1423",3,"2012-09-02T22:26:17+0000","The success of the Windows 8 operating platform will largely determine the fate of Microsoft's struggling cellphone partner, Nokia, which has bet its survival on the software.","Hoping for Turnaround, Nokia Bets on Windows 8","Business","Microsoft"
"1424",4,"2012-08-31T10:56:31+0000","Doing your research before downloading freeware and shareware can help keep your computer safer.","Q&A: Be Cautious With Free Software","","Microsoft"
"1425",5,"2012-08-20T14:58:43+0000","David O. Sacks, the chief executive of Yammer, who recently sold his business to Microsoft for $1.2 billion, is suddenly bearish on start-ups. On Saturday, he wrote on Facebook: “I think Silicon Valley as we know it may be coming to an end.”","After Microsoft Deal, Yammer Chief Issues Gloomy Forecast for Silicon Valley’s Start-Ups","","Microsoft"
"1426",6,"2012-08-29T19:34:29+0000","Samsung, the world’s biggest phone maker, showed the first smartphone to include Windows Phone 8, the next version of Microsoft’s mobile operating system. In making this announcement, Samsung is beating even Nokia, Microsoft’s partner for making W...","Samsung Is First in Line With a Windows Phone 8 Device","","Microsoft"
"1427",7,"2012-08-14T12:58:29+0000","Microsoft is changing the name Windows Live ID to “Microsoft account” for those signing into its online services.","Q&A: Sorting Accounts With Microsoft","","Microsoft"
"1428",8,"2012-08-28T11:39:30+0000","Microsoft Word includes a setting to add line (and remove) line numbers to a document for easier collaborative editing.","Q&A: Putting Line Numbers in Word Docs","","Microsoft"
"1429",9,"2012-08-25T03:49:10+0000","Companies that make smartphones will have to be cautious in how they design products to avoid being accused of imitating Apple.","A Verdict That Alters an Industry","Business","Microsoft"
"1430",10,"2012-08-21T16:12:26+0000","Bill Gates, Liberty Global and Lux Capital are investing in Kymeta, a start-up uses a lightweight material to make antennas intended to improve satellite connections used for broadband Internet.","Antenna Company Raises $12 Million From Bill Gates and Lux Capital","","Microsoft"
"1431",1,"2012-12-25T21:10:48+0000","It has taken years, but businesses are adopting Google’s idea of using cloud-based software. This represents a challenge to Microsoft, which has its own cloud computing product.","Google Apps Challenging Microsoft in Business","Business","Microsoft"
"1432",2,"2012-12-21T17:43:41+0000","Microsoft Office can automatically save your open files for you as you work, but you can increase or decrease the frequency of the saving.","Q&A: Setting AutoSave Times In Microsoft Office","","Microsoft"
"1433",3,"2012-12-26T13:19:31+0000","When it comes to enterprise software for the cloud, Google is gaining ground on Microsoft.","Daily Report: Google Moves Onto Microsoft’s Turf in Business Software","","Microsoft"
"1434",4,"2012-12-15T02:15:47+0000","Mark Penn made a name for himself in Washington by bulldozing enemies of the Clintons. Now he’s trying to do the same to Google, on behalf of its rival Microsoft.","A Political Brawler, Now Battling for Microsoft","Business","Microsoft"
"1435",5,"2012-12-17T15:42:45+0000","Two lawyers who helped build the antitrust case against Microsoft in the 1990s are playing important roles in an antitrust investigation of Google. But this time, Gary L. Reback and Susan A. Creighton are on opposite sides, Steve Lohr reports on M...","Daily Report: Legal Allies Against Microsoft, Divided on Google","","Microsoft"
"1436",6,"2012-12-11T22:24:13+0000","Microsoft plans to expand sales of its Surface tablet beyond its own stores, ending one of the more puzzling limitations to its Surface strategy.","Microsoft Will Expand Distribution of Surface Tablet","","Microsoft"
"1437",7,"2012-12-26T19:38:49+0000","Software consulting is a multibillion-dollar business, and the means by which most enterprise software actually ends up in business. Consultants figure out what companies need, install it, customize it, and train workers on it. As more software is...","How the Cloud Changes Software Consulting","","Microsoft"
"1438",8,"2012-12-26T12:56:05+0000","Windows 8 offers keyboard shortcuts to jumping to the Control Panel, apps and other frequently used parts of the system that used to reside in the old Windows Start menu.","Tip of the Week: Start Menu Alternatives for Windows 8","","Microsoft"
"1439",9,"2012-12-23T21:55:07+0000","Weak PC sales this holiday season suggest the struggles of Microsoft and other companies that depend heavily on the computer business will not abate soon.","No Sales Pop for a New Version of Windows","Business","Microsoft"
"1440",10,"2012-12-28T14:04:58+0000","The British publishing and education company Pearson says it will invest $89.5 million in the digital Nook business for a 5 percent stake, as Barnes & Noble says that its holiday sales will be below expectations.","Pearson to Take Stake in Nook Unit","","Microsoft"
"1441",1,"2012-12-20T15:00:43+0000","Microsoft Word is full of shortcuts, and you can even add your own custom keyboard commands.","Q&A: Customizing Word Keyboard Shortcuts","","Microsoft"
"1442",2,"2012-12-31T21:08:58+0000","Consumers and businesses spend billions of dollars a year on antivirus software, but these programs rarely block freshly minted strains, because the malware creators move too fast.","Outmaneuvered at Their Own Game, Antivirus Makers Struggle to Adapt","Business","Microsoft"
"1443",3,"2012-12-19T21:08:33+0000","If you find your online address book is full of duplicate entries, Google’s Gmail, Yahoo Mail and Microsoft’s Hotmail/Outlook.com services all offer tools for quick housekeeping.","Tip of the Week: Clean Up Your Web Mail Address Book","","Microsoft"
"1444",4,"2012-12-18T01:43:40+0000","Microsoft products, from Bing to Windows phones, have been showing up on “Gossip Girl” as part of a paid sponsorship.","‘Gossip Girl’ Secret: Don’t Google It","","Microsoft"
"1445",5,"2012-12-16T20:26:10+0000","Years ago, two lawyers saw Microsoft’s fast grip on the PC software market as anticompetitive. Today, they disagree on whether Google represents a similar force in search.","Onetime Allies in Antitrust Part Ways Over Google","Business","Microsoft"
"1446",6,"2012-11-29T05:01:12+0000","IDC predicts that 2013 is the year when Microsoft must sharply increase its support among mobile applications developers if it is to avoid “a gradual track to demise.” But it faces the network-effect flywheel: developers follow consumers, whose pu...","Microsoft Faces ‘Year of Reckoning’ in Mobile Software, IDC Says","","Microsoft"
"1447",7,"2012-12-10T14:19:09+0000","A first look at Lenovo’s fancy ultrabook shows a nagging problem in the main software: Microsoft still thinks in terms of its products, instead of the experiences it promises to deliver.","Windows 8’s Clarity Problem","","Microsoft"
"1448",8,"2012-12-09T22:59:00+0000","Shaping the browsers of the future has become a spirited struggle among the big tech companies that see the mobile world as a make-or-break business.","Browser Wars Flare Again, on Little Screens","Business","Microsoft"
"1449",9,"2012-12-09T23:36:51+0000","As the cameras and screens of smartphones and tablets improve, and as wireless networks offer higher bandwidth, more companies are enabling mobile video calls.","Mobile Video Calling Creates a New Frontier","Business","Microsoft"
"1450",10,"2012-12-07T23:32:23+0000","Microsoft and Spike TV are making a push to make television interactive with the Video Game Awards, an annual ceremony that Xbox users will be able to shape themselves during its live broadcast. Xbox viewers will be able to respond to live polls a...","With Game Awards Ceremony, Xbox Users to Direct the Show","","Microsoft"
"1451",1,"2012-12-07T12:46:59+0000","Unless the files are copy-protected, you can play music from your iTunes collection on a Windows Phone.","Q&A: Using iTunes Music on a Windows Phone","","Microsoft"
"1452",2,"2012-12-05T15:47:37+0000","The world’s biggest chip maker sometimes learns from the giants of the cloud computing world.","Intel’s Schooling From the ‘Big Four’ Cloud Customers","","Microsoft"
"1453",3,"2012-11-29T22:38:33+0000","While Microsoft has promoted big sales figures for Windows 8 this week, NPD, a retail sales tracking firm, is painting a darker picture of the product’s introduction. NPD estimated that sales of Windows PCs in retail stores in the United States fe...","Research Firm Says Windows 8 Had a Rocky Start","","Microsoft"
"1454",4,"2012-11-14T20:11:59+0000","TimesCast Media+Tech: The abrupt departure of Microsoft’s Steven Sinofsky. | David Pogue reviews fitness bands in 60 seconds. | Integrating technology into the way children play.","Parallel Exits at Microsoft and Apple","ContinuousNews","Microsoft"
"1455",5,"2012-11-28T12:03:49+0000","Screen saver programs can serve up information on the computer’s monitor when you are not using the machine.","Tip of the Week: Screen Savers That Educate","","Microsoft"
"1456",6,"2012-11-13T01:36:20+0000","Steven Sinofsky, the leader of Microsoft’s Windows business, is leaving the company, just weeks after the company released the biggest overhaul in decades of its flagship product.","The Leader of Windows Exits Microsoft","","Microsoft"
"1457",7,"2012-11-21T20:59:39+0000","Microsoft isn’t giving up. This month, Windows Phone 8 arrives aboard two fascinating new phones: the Nokia Lumia 920 and the HTC Windows Phone 8X.","Two Phones Dazzle, and Yet ...","Business","Microsoft"
"1458",8,"2012-11-22T03:37:21+0000","Sites like Google and Bing are showing the precise questions that are most frequently asked, giving everyone a chance to peer virtually over one another’s shoulders at private curiosities.","Don’t Ask? Internet Still Tells","National","Microsoft"
"1459",9,"2012-11-21T12:40:23+0000","When that Microsoft Word document is finally complete and everyone who worked on it is happy, you can remove all the comments embedded in the file at once.","Q&A: Deleting the Conversation in Word","","Microsoft"
"1460",10,"2012-11-20T14:25:52+0000","Concerns that data collected by government agencies could ultimately be sold to third parties has prompted some agencies to postpone efforts to move their databases.","European Governments Staying Out of the Cloud","Business","Microsoft"
"1461",1,"2012-11-19T00:40:15+0000","Tablets were supposed to be a simple alternative to the bloated personal computer market. But now that the iPad has strong competitors, shopping decisions are becoming harder.","The Tablet Market Grows Cluttered","Business","Microsoft"
"1462",2,"2012-11-16T20:05:27+0000","One of the most frustrating experiences with using Apple TV, Xbox and other Internet-connected boxes is text entry. That’s why Xbox SmartGlass, a new app that lets users control their game consoles from touch screen devices, seems so exciting. Unf...","SmartGlass App for Controlling Your Xbox Has a Few Holes","","Microsoft"
"1463",3,"2012-11-15T12:38:38+0000","You do not need Apple’s iPhoto program to easily make professionally printed books from your own picture albums.","Q&A: Making Picture Books on a PC","","Microsoft"
"1464",4,"2012-11-14T13:13:44+0000","According to several current and former Microsoft executives, several run-ins with other company leaders led to Steven Sinofsky’s departure, reports Nick Wingfield in The New York Times.","Daily Report: Sinofsky’s Abrasive Nature","","Microsoft"
